RBD;NOM_RBD
9631;ESCUELA ESPECIAL DE ADULTOS
9634;COLEGIO MARISTA MARCELINO CHAMPAGNAT
9635;ESCUELA ESPECIAL PART. EDUCADORAS AGAZZI
9636;CHILEAN EAGLES COLLEGE-LA PINTANA
9637;COLEGIO CHRISTIAN GARDEN SCHOOL
9638;ESCUELA BÁSICA PADRE ESTEBAN GUMUCIO VIVES
9639;ESCUELA PARTICULAR EMA DIAZ SIERRA
9642;ESCUELA PARTICULAR TTE.DAGOBERTO GODOY
9646;COLEGIO POLIVALENTE FRANCISCO RAMIREZ
9647;LICEO SAN FRANCISCO
9648;ESCUELA PARTICULAR FRANCISCO DE MIRANDA
9653;ESCUELA BASICA PRESBITERIANA EL SALVADOR
9654;ESCUELA PARTICULAR FRANCISCO RAMIREZ
9655;ESCUELA PARTICULAR CLAUDIO MATTE
9656;ESCUELA PARTICULAR PDTE.JOSE J.PRIETO
9659;ESCUELA COLEGIO ALBERTO BLEST GANA
9660;ESCUELA PARTIC PARROQUIAL DOMINGO SAVIO
9663;ESCUELA PARTICULAR ELSA RAMIREZ
9664;COLEGIO PARTICULAR PUERTO NAVARINO
9665;CENTRO EDUCACIONAL SANTA ROSA DEL SUR
9666;ESC. PART. CELESTIN FREINET
9667;ESC.PART. ESPECIAL NUESTRO MUNDO
9668;ESCUELA BASICA OSCAR SALINAS
9669;COLEGIO NUESTRO MUNDO
9673;ESCUELA PARTICULAR ARTURO MATTE LARRAIN
9674;ESCUELA BASICA ALAS DE AGUILA
9676;ESCUELA PARTICULAR SAN MARCELO
9680;COMPLEJO EDUC.STA.RITA DE CASIA-ANEXO 1
9684;COLEGIO SAN GREGORIO DE LA SALLE
9685;ESCUELA BASICA PARTIC ESTRELLA DE CHILE
9686;LICEO TÉCNICO CLOTARIO BLEST RIFFO
9687;LICEO CHRISTA MC AULIFFE
9688;LICEO JUAN GOMEZ MILLAS
9690;CENTRO DUC.CARDENAL JOSE MARIA CARO
9693;LICEO POLITECNICO CIENCIA Y TECNOLOGIA
9694;INSTITUTO COMERCIAL PADRE ALBERTO HURTADO DE PEDRO AGUIRRE CERDA
9695;LICEO POLIVALENTE EUGENIO PEREIRA SALAS
9697;LICEO POLIVALENTE
9698;ESCUELA BASICA AVIADORES
9699;COLEGIO NACIONES UNIDAS
9700;COLEGIO PALESTINO
9701;LICEO POLIVALENTE OLOF PALME
9702;ESCUELA BASICA MARIO ARCE GATICA
9703;ESCUELA ESPERANZA JOVEN
9704;ESCUELA LO VALLEDOR
9705;ESCUELA BASICA SALOMON SACK
9706;ESCUELA BAS. OSCAR ENCALADA YOVANOVICH
9709;ESCUELA BLUE STAR COLLEGE
9710;ESCUELA BASICA SANTA ADRIANA
9713;COMPLEJO EDUCACIONAL FELIPE HERRERA LANE
9714;ESCUELA BASICA JOSE MARTI
9715;ESCUELA BASICA VILLA SANTA ELENA
9716;ESCUELA BASICA ACAPULCO
9717;ESCUELA CIUDAD DE LYON
9718;ESCUELA BASICA PAUL HARRIS
9719;ESCUELA BASICA
9720;COLEGIO HERNAN OLGUIN
9721;ESCUELA NEMESIO ANTUNEZ
9722;LICEO PORTAL DE LA CISTERNA
9726;LICEO TENIENTE FRANCISCO MERY AGUIRRE
9727;ESCUELA CIUDAD DE BARCELONA
9728;ESCUELA DIFERENCIAL PARA NINOS SORDOS
9729;ESCUELA VILLA SUR
9730;COLEGIO ANTU
9733;ESCUELA BASICA CLARA  ESTRELLA
9734;ESCUELA  RAUL SAEZ SAEZ
9736;ESCUELA BASICA BERNARDO O´HIGGINS
9738;COLEGIO PARQUE LAS AMERICAS
9740;ESCUELA BASICA REPUBLICA DE LAS FILIPINAS
9741;ESCUELA BASICA COEDUCACIONAL
9747;C.E.I.A.PEDRO AGUIRRE CERDA
9750;COLEGIO LO ESPEJO
9754;INSTITUTO COMERCIAL PARTICULAR LA CISTERNA
9757;CENTRO EDUCACIONAL SANTA CLARA
9758;COLEGIO SANTA ISABEL DE HUNGRIA
9759;LICEO LAURA VICUNA
9766;COLEGIO SANTA MARIA DE LOS ANGELES
9767;LICEO MADRE CECILIA LAZZERI
9768;ESCUELA Y LICEO LIAHONA
9771;CHILEAN EAGLES COLLEGE - LA CISTERNA
9772;ESCUELA ESPECIAL NTA SENORA DE LAS PENAS
9778;ESCUELA JOSE ABELARDO NUNEZ Nº 1
9779;ESCUELA TECNICA SANTA ROSA
9780;COLEGIO TENIENTE DAGOBERTO GODOY
9781;CENTRO POLITECNICO PARTICULAR SAN RAMON
9784;LICEO TÉCNICO INDUSTRIAL LA CISTERNA
9786;ROSA MARCKMANN DE GONZALEZ
9788;ESCUELA PARTICULAR GRACIELA L.DE IBANEZ
9789;ESCUELA PARTICULAR PABLO GOYENECHE IVER
9796;ESC. PART.ADVENTISTA BUENAVENTURA
9797;COLEGIO ADVENTISTA LA CISTERNA
9799;COMPLEJO EDUC.PART.MONSENOR LUIS A.PEREZ
9800;ESCUELA BAS. ROSA ELVIRA MATTE DE PRIETO
9801;COLEGIO POLIV. SAINT ORLAND
9803;ESCUELA PARTICULAR HISPANO AMERICANO
9804;ESCUELA PABLO DE TARSO
9805;ESCUELA PARTICULAR CAMPANITA
9807;ESCUELA PARTICULAR LOCARNO
9808;ESCUELA PARTICULAR GUIA ESTUDIANTIL
9809;ESCUELA PARTICULAR SAINT PHILLIP OF NERY
9810;LICEO POLITECNICO PART.SAGRADO CORAZON
9811;ESCUELA PART. REPUBLICA ALEMANIA FEDERAL
9816;ESCUELA PARTICULAR STA.MARIA MAZZARELLO
9817;COLEGIO PARTICULAR KENNEDY
9824;COMPLEJO EDUCACIONAL STELLA MARIS
9825;ESCUELA PARTICULAR ESPECIAL G.MISTRAL
9827;COLEGIO IDOP LIMITADA
9828;COLEGIO SOL DE CHILE
9829;COLEGIO MIGUEL DE CERVANTES
9830;ESCUELA PARTICULAR SAN MARTIN DE PORRES
9834;COLEGIO POLITEC. MARIA GRISELDA VALLE S.
9841;ESCUELA PARTICULAR MIGUEL DE CERVANTES
9842;ESCUELA PARTICULAR NUESTRA INFANCIA
9844;COLEGIO EL ALMENDRO
9845;COLEGIO GRACE SCHOOL
9847;ESCUELA PARTICULAR KAROL C.DE CRACOVIA
9850;ESCUELA PARTICULAR LOS LAGOS CHILE
9852;ESCUELA PARTICULAR VILLA EL SOL
9853;COLEGIO POLIV. SAINT TRINITY COLLEGE
9859;COLEGIO PARTICULAR VILLA JESUS
9860;LICEO INDUSTRIAL DE ELECTROTECNIA RAMON B
9861;CENTRO EDUC.MUNIC. DR. AMADOR NECHME R.
9862;LICEO POLIVALENTE A N°71 GUILLERMO FELIU CRUZ
9863;LICEO SANTIAGO BUERAS Y AVARIA
9864;LICEO JOSE IGNACIO ZENTENO
9865;LICEO POLIVALENTE DR. LUIS VARGAS SALCEDO
9866;LICEO COMERCIAL B-72
9867;CENTRO DE EDUC. TECN.PROFESIONAL CODEDUC
9869;ESCUELA BASICA REPUBLICA DE FRANCIA
9870;ESCUELA BASICA CONDORES DE PLATA
9872;ESCUELA BASICA PROF.RAMON DEL RIO
9873;ESCUELA BASICA PACTO ANDINO
9874;ESCUELA LOTHAR KOMMER BRUGER
9875;ESCUELA CERRILLOS
9876;ESCUELA GENERAL SAN MARTIN
9877;ESCUELA GENERAL OHIGGINS
9878;ESCUELA PRESIDENTE RIESCO ERRAZURIZ
9879;ESCUELA BASICA
9880;ESCUELA  BASICA  ESTADO  DE  PALESTINA
9881;ESCUELA VICENTE REYES PALAZUELOS
9882;ESCUELA J.PRIETO VIAL
9883;ESCUELA BÁSICA N 263 RAMON FREIRE
9884;ESCUELA LEON HUMBERTO VALENZUELA
9886;ESCUELA ESTRELLA REINA DE CHILE
9887;ESCUELA EL LLANO DE MAIPU
9888;ESCUELA SANTA ADELA
9889;LICEO REINO DE DINAMARCA
9890;ESCUELA TOMAS VARGAS
9891;REPUBLICA DE GUATEMALA
9892;ESCUELA LAS AMERICAS
9893;ESCUELA ESPECIAL ANDALUE
9895;ESCUELA BASICA REINA DE SUECIA
9896;LICEO ALCALDE GONZALO PEREZ LLONA
9897;LICEO POLITECNICO PARTICULAR HANNOVER
9900;POLITECNICO ALEMAN ALBERT EINSTEIN
9901;ESCUELA PARTICULAR FRANZ LISZT
9902;ESCUELA PARTICULAR ESPECIAL DON ORIONE
9903;COLEGIO LOS CONQUISTADORES
9905;LICEO SAN PEDRO POVEDA
9906;ESCUELA PARTICULAR INSTITUTO AMERICA
9907;COLEGIO POLIVALENTE CAMILO HENRIQUEZ
9909;CENTRO EDUCACIONAL PIAMARTINO CAROLINA LLONA DE CUEVAS
9910;COLEGIO PARTICULAR SAN FELIX
9911;COLEGIO DE LA PROVIDENCIA C.LARRAIN DE I
9912;COLEGIO PART. ASCENSION NICOL
9913;COLEGIO ESC.  JOSE MANSO DE VELASCO
9916;ESCUELA DE PARVULOS LOS PAISES BAJOS
9917;COLEGIO POLIVALENTE PATRICIO MEKIS
9919;COLEGIO PARTICULAR MATER DEI
9920;ESC. BASICA DIVINO JESUS
9922;ESCUELA PARTICULAR HOLANDA
9924;COLEGIO ALBERTO PEREZ
9926;COLEGIO SOFIA INFANTE HURTADO
9928;ESCUELA PARTICULAR AMANECER
9930;ESCUELA PARTICULAR JOSE ANTONIO LECAROS
9937;LICEO MATER PURISSIMA
9939;ESCUELA BASICA CAMPOS DE MAIPU-CERRILLOS
9940;ESCUELA LICEO MADRE VICENCIA
9942;ESCUELA, COLEGIO POLITEC.H.DE MAGALLANES
9945;COLEGIO ELLEN COLLEGE
9946;ESCUELA PARTICULAR LA MONTANA
9947;COLEGIO INDUSTRIAL PART. DON ORIONE
9948;ESCUELA PARTICULAR SAINT RODRIC COLLEGE
9950;COLEGIO EL REDENTOR
9953;CENTRO EDUCACIONAL SAN ANDRES
9955;COLEGIO ROSITA SANCHEZ
9957;LICEO INDUSTRIAL ALBERTO WIDMER
9959;COMPLEJO EDUCACIONAL MAIPU
9960;ESCUELA PARTICULAR VILLA ESPANA
9963;COLEGIO PARTICULAR ESPECIAL JUAN XXIII
9967;ESCUELA PARTICULAR RUBEN DARIO
9968;ESCUELA ESPECIAL EDUCACIONAL AGAZZI
9972;ESC. BASICA PARTIC.SAINT MAURICES
9973;COLEGIO SANTA URSULA
9979;COLEGIO PETER COLLEGE
9981;LICEO INDUSTRIAL DOMINGO MATTE PEREZ
9982;LICEO COMERCIAL MOLINA LAVIN
9985;LICEO GUILLERMO LABARCA HUBERTSON
9986;LICEO POLITECNICO
9987;ESCUELA PLATON
9991;ESCUELA ABATE MOLINA
9992;ESCUELA DIEGO PORTALES
9993;ESCUELA INGLATERRA
9994;ESCUELA ANGELMO
9995;ESCUELA INSIGNE GABRIELA
9996;ESCUELA ESPANA
9998;ESCUELA LO FRANCO
9999;ESCUELA ANTUMALAL
10000;ESCUELA CALICANTO
10001;ESCUELA MEMBRILLAR
10005;ESCUELA BASICA MUNICIPAL GRENOBLE
10006;ESCUELA REPUBLICA DE LA INDIA
10010;MUSTAFA KEMAL ATATURK
10012;ESCUELA GIL DE CASTRO
10014;ESCUELA PARTICULAR ANDRES BELLO
10015;ESCUELA OLGA NAVARRO SEPULVEDA
10018;ESCUELA PARTICULAR JOSE JOAQUIN PEREZ
10019;ESCUELA PARTICULAR SAN JOSE SCHOOL
10021;ESCUELA PARTICULAR VICTOR HUGO
10023;LICEO ALBERTO HURTADO
10026;ESCUELA PARTICULAR MONTE GRANDE
10028;ESCUELA N°1124 ALIANZA AMERICANA
10030;LICEO POLIV.SAN JOSE DE LA PRECIOSA SANG
10032;ESCUELA BASICA PARTICULAR  Nº 488 `ZENON TORREALBA`
10035;ESCUELA PARTICULAR NUEVO HORIZONTE
10036;ESCUELA PARTICULAR PDTE. ABRAHAM LINCOLN
10041;COLEGIO SAINT MARK
10042;ESCUELA PARTICULAR ELVIRA HURTADO DE M.
10044;CENTRO EDUCACIONAL ALBERTO HURTADO
10046;ESCUELA PARTICULAR SAGRADA FAMILIA
10052;LICEO POLITECNICO SAN FRANCISCO SOLANO
10056;ESCUELA DIFERENCIAL LOS LIRIOS
10058;COLEGIO POLIVALENTE PRINCIPE DE GALES
10063;ESCUELA PARTICULAR CARMEN CHACON
10064;ESCUELA PARTICULAR MARIA CRISTINA
10069;COLEGIO MARQUEL
10073;LICEO INDUSTRIAL VICENTE PEREZ ROSALES
10074;ESCUELA ALIANZA
10075;LICEO POLIVALENTE LOS HEROES DE LA CONCEPCIÓN
10076;COMPLEJO EDUCACIONAL PEDRO PRADO
10077;LICEO MUN. CENTRO EDUCACIONAL PUDAHUEL
10080;ESCUELA TENIENTE HERNAN MERINO CORREA
10081;ESCUELA ESTRELLA DE CHILE
10083;ESCUELA PRESIDENTE ROOSEVELT
10085;ESCUELA ESTADO DE FLORIDA
10086;ESCUELA REPUBLICA DE ITALIA
10087;ESCUELA REPUBLICA DE CROACIA
10088;ESCUELA HERMINDA DE LA VICTORIA
10089;ESCUELA JAIME GOMEZ GARCIA
10090;ESCUELA ALEXANDER GRAHAM BELL
10091;ESCUELA PROFESORA GLADYS VALENZUELA V
10092;ESCUELA GOLDA MEIR
10093;ESCUELA MILLAHUE
10095;ESCUELA IGNACIO CARRERA PINTO
10097;ESCUELA MARISCAL DE AYACUCHO
10098;ESCUELA PROVINCIA DE ARAUCO
10099;ESCUELA GENERAL RENE ESCAURIAZA
10100;ESCUELA EL SALITRE
10102;ESCUELA ALBERT EINSTEIN
10103;ESCUELA SOR TERESA DE LOS ANDES
10104;ESCUELA MONSENOR CARLOS OVIEDO
10105;ESCUELA FEDERICO ACEVEDO SALAZAR
10106;ESCUELA POETA PABLO NERUDA
10107;ESCUELA BASICA PAULO FREIRE
10108;ESCUELA LEONARDO DA VINCI
10109;ESCUELA DOCTOR TREVISO GIRARDI TONELLI
10113;ESCUELA ELVIRA SANTA CRUZ OSSA
10114;ESCUELA BASICA N°389 REPUBLICA DE ESTADOS UNIDOS
10116;COLEGIO NEPTUNO
10117;ESCUELA MARIA LUISA BOMBAL
10119;ESCUELA POETA VICENTE HUIDOBRO
10120;LICEO DE ADULTOS ALBERTO GALLEGUILLOS J.
10121;ESCUELA CIUDAD SANTO DOMINGO DE GUZMAN
10122;ESCUELA PROF. MANUEL GUERRERO CEBALLOS
10123;ESCUELA BASICA MELVIN JONES
10124;ESCUELA SAN DANIEL
10125;ESCUELA SARGENTO CANDELARIA
10126;COMPLEJO EDUCACIONAL CERRO NAVIA
10127;ESC.DE EDUCACION DIFERENCIAL QUILLAHUE
10128;ESCUELA CENTRO EDUC.INTEGRAL DE ADULTOS
10130;LICEO CIUDAD DE BRASILIA
10133;ESCUELA BASICA G-N°320 LIPANGUE
10134;ESC.COMODORO ARTURO MERINO BENITEZ
10135;ESCUELA LO BOZA
10140;ESCUELA PARTICULAR FRINGS COLLEGE
10142;ESCUELA BASICA PARTICULAR N°811 DRA.VICTORIA GARCIA
10143;ESCUELA PARTICULAR ESPANA
10147;ESCUELA PARTICULAR BABILONIA
10149;ESCUELA PARTICULAR RAPA NUI
10151;COLEGIO CRISTIAN AND CAREN SCHOOL
10152;ESCUELA PARTICULAR ANDANTINO
10155;ESCUELA CHARLES SCHOOL-DIURNA
10156;ESCUELA JARDIN LO PRADO
10157;COLEGIO MINISTRO DIEGO PORTALES
10158;ECUELA BÁSICA Nº312 MOLOKAI
10159;ESCUELA PARTICULAR ROBERT KENNEDY
10160;ESCUELA BAS. COLEGIO BAU
10162;LICEO TENIENTE DAGOBERTO GODOY NO.3
10164;COLEGIO SAN FRANCISCO JAVIER
10167;ESCUELA BASICA N°1058 SANTA BEATRIZ
10168;ESCUELA PARTICULAR SAN VICENTE FERRER
10171;ESCUELA PARTICULAR VILLA LOURDES
10172;ESC BAS PART CENTRO EDUCACIONAL SN PABLO
10173;ESCUELA PART. SUNS SCHOOL
10176;ESCUELA PARTICULAR ESPECIAL RENACER
10182;ESCUELA  BASICA  N° 912 ELLEN  COLLEGE
10183;ESCUELA PARTICULAR CARLOS PEZOA VELIZ
10186;ESCUELA PARTICULAR LA FRONTERA
10187;COLEGIO MADRE ANA EUGENIA
10191;ESCUELA PARTICULAR LA CIUDAD EDUCATIVA
10193;COLEGIO POLIV. SAINT ORLAND N 3
10196;LICEO INDUSTRIAL BENJAMIN DAVILA LARRAIN
10197;ESCUELA JUANA DE LESTONAC
10199;LICEO POLIVALENTE A80 PRESIDENTE JOSE MANUEL BALMACEDA
10200;ESCUELA BASICA ISABEL LE BRUN
10201;LICEO THOMAS ALVA EDISON
10202;ESCUELA DOMINGO SANTA MARIA GONZALEZ
10204;ESCUELA CAPITAN JOSE LUIS ARANEDA
10205;ESCUELA GENERAL MANUEL BULNES PRIETO
10207;ESCUELA REBECA MATTE BELLO
10210;ESCUELA GENERAL ALEJANDRO GOROSTIAGA O
10212;ESCUELA JUANA ATALA DE HIRMAS
10216;ESC. BASICA MONSERRAT ROBERT DE GARCIA
10217;COLEGIO PARTICULAR HELENICO
10219;COLEGIO CORAZON DE JESUS DE RENCA
10220;COLEGIO PRESIDENTE ALESSANDRI
10221;COLEGIO PARTICULAR CHARLES DARWIN
10223;LICEO SANTA TERESITA
10224;COLEGIO ARTURO TORO AMOR
10225;ESCUELA PARTIC. COLEGIO BALMACEDA-RENCA
10226;ESCUELA PARTICULAR SAN GENARO
10228;ESCUELA PARTICULAR PRIMITIVA ECHEVERRIA
10229;ESCUELA PARTICULAR JOSE BERNARDO SUAREZ
10232;COLEG. POLIV. SANTA MARIA DE LA PROVIDENCIA
10233;ESCUELA PARTICULAR SAN FIDEL
10234;ESCUELA ESPECIAL PARTICULAR ESPERANZA
10235;ESCUELA BASICA  N° 878  LOS ACACIOS
10239;ESCUELA ESTADO DE MICHIGAN
10240;ESCUELA LUIS CRUZ MARTINEZ
10241;ESCUELA BASICA EL MANIO
10245;PARROQUIAL NUESTRA SEÑORA DEL CARMEN DE QUILICURA
10246;COLEGIO POLIV. SANTA MARIA
10247;ESCUELA BASICA PART PAULA JARAQUEMADA
10248;LICEO INSTITUTO TECNOLOGICO Y COMERCIAL RECOLETA-INTECO
10250;CENTRO EDUCACIONAL DE HUECHURABA
10251;LICEO POETA FEDERICO GARCIA LORCA
10252;LICEO ARTURO PEREZ CANTO
10253;LICEO POLIV. ABDON CIFUENTES
10254;CENTRO EDUCACIONAL JOSE MIGUEL CARRERA
10255;COMPLEJO EDUCACIONAL JUANITA FERNANDEZ SOLAR
10257;ESCUELA SARGENTO 2. DANIEL REBOLLEDO
10259;LICEO ALBERTO BLEST GANA
10260;ESCUELA UNESCO
10262;ESCUELA ESPANA
10263;ESCUELA D-114
10264;ESCUELA SOL NACIENTE
10265;ESCUELA HORACIO JOHNSON GANA
10266;ESCUELA DRA.ELOISA DIAZ INSUNZA
10267;ESCUELA ESCRITORA MARCELA PAZ
10268;ESCUELA PUERTO RICO
10269;LICEO MUNC.ALMIRANTE GALVARINO RIVEROS
10270;CENTRO EDUC.ESCRITORES DE CHILE
10271;ESCUELA ARAUCARIAS DE CHILE
10272;ESCUELA BASICA CARLOS PRATS G.
10273;ESCUELA VALLE DEL INCA
10277;ESCUELA ADELAIDA LA FETRA
10278;ESCUELA PEDRO AGUIRRE CERDA
10279;ESCUELA ALLIPEN
10280;CENTRO EDUC. POETA EUSEBIO LILLO
10281;ESCUELA ATENEA
10282;ESCUELA LUIS GALDAMES
10283;ESCUELA AVIADOR DAGOBERTO GODOY F.
10285;ESCUELA SANTA VICTORIA DE HUECHURABA
10288;ESCUELA BASICA LIKAN-ANTAI
10290;ESCUELA LAS CANTERAS
10291;ESCUELA VICTOR CUCCUINI
10293;ESCUELA ESP. HUMBERTO ARANDA IRRIBARREN
10300;ESCUELA MARTA COLVIN
10301;ESCUELA CAMILO HENRIQUEZ
10302;ESCUELA ANNE ELEONOR ROOSEVELT
10305;ESCUELA SANTIAGO DE GUAYAQUIL
10306;ESCUELA MUN.HERMANA MARIA GORETTI
10307;ESCUELA RAFAEL VALDIVIESO
10309;ESCUELA EDUC.DIF. STA. TERESA DE AVILA
10313;COLEGIO POLIV. ALEJANDRO FLORES
10315;COLEGIO CRISTOBAL COLON
10320;LICEO AVENIDA RECOLETA
10321;LICEO LAS AMERICAS MODERNAS
10324;ESCUELA JOSE ABELARDO NUÑEZ Nº 3
10326;ESCUELA PARTICULAR SAN JOSE
10327;ESCUELA PARTICULAR SANTA TERESITA
10329;COLEGIO LIBERTADOR SAN MARTIN
10331;COLEGIO ISABEL RIQUELME
10332;ESCUELA PARTICULAR EL CARMEN
10333;ESCUELA PARTICULAR N.SRA.DE GUADALUPE
10334;ESCUELA PATROCINIO EL SEMBRADOR N 2
10335;ESCUELA SAN JORGE
10336;ESCUELA PARTICULAR SAN DIEGO
10337;COLEGIO MATER DOLOROSA
10338;ESCUELA BASICA SANTO DOMINGO
10341;ESCUELA BASICA PART. THE LITTLE SCHOOL
10344;COLEGIO HELLEN'S COLLEGE
10345;ESCUELA PARTICULAR FRANCISCO BILBAO
10346;ESCUELA BASICA INES DE SUAREZ
10348;ESCUELA BASICA PART.MARY ANNE SCHOOL
10350;COLEGIO ELENA BETTINI
10351;ESCUELA PARTICULAR PARQUE ASUNCION
10352;ESC.BASICA PART. NUEVA AURORA DE CHILE
10353;ESCUELA ESPECIAL PARTICULAR LA PIRAMIDE
10355;COLEGIO PARTICULAR JUAN PABLO
10359;ESCUELA PART. SANTA LUISA DE MARILLAC
10361;ESCUELA PARTICULAR ZOLTAN DIENES
10362;ESCUELA PARTICULAR HNAS.AGAZZI
10363;ESCUELA PARTICULAR JAIME EYZAGUIRRE
10364;ESCUELA BÁSICA Nº 953 JOSE ARTIGA
10365;ESCUELA BAS. ISABEL GONZALEZ CARES
10372;ESCUELA PARTICULAR ISLA DE PASCUA
10375;ESCUELA PARTICULAR RUTH
10376;ESC. PART. LATINOAMERICANA
10377;LICEO POLIVALENTE SAINT ANDREWS
10384;ESCUELA BASICA PART.BRIGIDA WALKER
10385;ESCUELA PART. ADVENTISTA SANTIAGO NORTE
10386;ESCUELA ESPECIAL BELLA ESPERANZA
10396;LICEO POLIVALENTE RAFAEL DONOSO CARRASCO
10397;LICEO INDUSTRIAL DE RECOLETA
10398;LICEO REBECA OLIVARES BENITEZ
10399;LICEO POLIVALENTE RIGOBERTO FONTT I.
10400;ESCUELA BASICA MARCOS GOOYCOLEA CORTES
10401;ESCUELA BASICA SANTA TERESA DEL CARMELO
10402;ESCUELA ESPECIAL ERNESTO SOTO NEGRETE
10403;ESCUELA PREMIO NOBEL PABLO NERUDA
10404;ANDALIEN DE COLINA
10405;LICEO ESMERALDA
10407;ESCUELA BASICA ALGARROBAL
10408;LICEO CORONEL ENRIQUE CABRERA JIMENEZ
10409;ESC.BASICA FRANCISCO PETRINOVIC KARLOVAC
10410;ESCUELA BASICA SAN VICENTE DE LO ARCAYA
10411;ESCUELA BASICA SANTA MARTA DE LIRAY
10412;ESCUELA SAN FRANCISCO DE ASIS
10413;ESCUELA PARTICULAR PAPELUCHO
10415;ESCUELA PARTICULAR DESIREE
10416;CENTRO DE TRATAMIENTO INTEGRAL LOS LAURELES
10419;COMPLEJO EDUCACIONAL DE LAMPA
10420;ESCUELA MANUEL SEGOVIA MONTENEGRO
10421;ESCUELA REPUBLICA DE POLONIA
10422;ESCUELA BASICA CACIQUE COLIN
10424;ESCUELA SANTA  BARBARA
10425;ESCUELA POLONIA GUTIERREZ C.
10426;ESCUELA BASICA F-N°371 SANTA ROSA DE LAMPA
10427;ESCUELA BASICA F - N°372 SANTA SARA
10428;ESCUELA BASICA G-N°373 EL LUCERO
10429;NORMA GONZÁLEZ GUERRA
10430;ESCUELA BASICA SAN SEBASTIAN DE BATUCO
10431;ESC. ESPECIAL PADRE LUIS GUANELLA
10432;LICEO POLIVALENTE MANUEL RODRIGUEZ
10433;LICEO HUERTOS FAMILIARES
10435;ESCUELA BASICA G-N°345 RUNGUE
10436;ESCUELA BASICA G-N° 346
10439;ESCUELA BASICA G-N°348
10441;ESCUELA BASICA G-N°349
10442;ESCUELA BASICA G-N°350
10443;LICEO MONTENEGRO
10444;ESCUELA BASICA G-N°352 PLAZUELA DE POLPAICO
10447;ESCUELA PARTICULAR LA MERCED
10449;ESCUELA CAMINO DE LUZ
10450;ESCUELA CONSOLIDADA
10452;LICEO PUENTE ALTO
10453;LICEO IND. MUNICIPALIZADO A N_ 116
10455;LICEO SAN GERONIMO
10456;LICEO COMERCIAL DE PUENTE ALTO
10457;COLEGIO MAIPO
10458;ESCUELA VILLA INDEPENDENCIA
10459;ESCUELA REPUBLICA DE GRECIA
10460;CENTRO EDUCACIONAL NUEVA CREACION
10461;ESCUELA LOS ANDES
10462;ESCUELA NONATO COO
10464;ESCUELA VILLA PEDRO AGUIRRE CERDA
10465;ESCUELA EJERCITO LIBERTADOR
10470;LICEO MUNIC.ING.MILITAR JUAN MACKENA O.
10472;ESCUELA CASAS VIEJAS
10473;ESCUELA OSCAR BONILLA
10474;ESCUELA LUIS MATTE LARRAIN
10475;ESCUELA GABRIELA
10476;ESCUELA LAS PALMAS
10478;ESCUELA SAN LUIS GONZAGA
10479;COLEGIO ESTELA SEGURA
10480;ESCUELA PIERRE VAYER
10482;COLEGIO ARTURO PRAT
10484;COLEGIO CORDILLERA
10487;COLEGIO POLIVALENTE DOMINGO MATTE MESIAS
10488;ESCUELA GENOVEVA MOLL BRIONES
10489;LICEO NUESTRA SENORA DE LAS MERCEDES
10491;ESCUELA SANTA JOAQUINA DE VEDRUNA
10492;COLEGIO CRISTIANO BELEN
10493;COLEGIO SAN LUIS DE GONZAGA II
10495;ESC. PART. SAN ANDRES
10496;ESCUELA INDUSTRIAL LAS NIEVES
10497;ESC. PARTICULAR JOSEFINA GANA DE J.
10500;COLEGIO POLIV. EL ALBORADA
10501;COLEGIO POLIV. PROFESOR ILDEFONSO CALDERON
10502;ESCUELA PARTICULAR MIGUEL CRUCHAGA T.
10503;COLEGIO EDUC.PART. COMP.DE MARIA P. ALTO
10505;LICEO POLIVALENTE MARIA REINA
10506;COLEGIO SENDA DEL SABER
10507;ESCUELA TECNICA LAS NIEVES
10515;ESCUELA DOMINGO FAUSTINO SARMIENTO
10516;LICEO MUNIC. TEC. PROF. EL LLANO
10519;ESCUELA BASICA G-N°646 LO ARCAYA
10520;LICEO  EL PRINCIPAL
10522;ESCUELA BASICA G-N°643 SAN JUAN DE PIRQUE
10524;ESCUELA BASICA G-841 SANTOS RUBIO MORALES
10526;LICEO POLIVALENTE SAN JOSE DE MAIPO
10527;ESCUELA JULIETA BECERRA ALVAREZ
10528;ESCUELA GABRIELA TOBAR PARDO
10529;ESCUELA BASICA F-N°638 EL MELOCOTON
10530;ESCUELA BASICA F-N°629 DE CONCENTRACION FRONTERIZA
10532;ESCUELA BASICA G-N°631 FRONTERIZA
10536;ESCUELA BASICA G-N°635 INTEGRADORA EL MANZANO
10537;ESCUELA BASICA G-N°636 SAN ALFONSO
10540;COLEGIO RAFAEL EYZAGUIRRE
10541;LICEO COMERCIAL DE SAN BERNARDO
10542;CENTRO EDUCACIONAL BALDOMERO LILLO
10543;LICEO POLIVALENTE A-127 FIDEL PINOCHET LE-BRUN
10544;LICEO ELVIRA BRADY MALDONADO-SN.BERNARDO
10545;LICEO IND. MIGUEL AYLWIN GAJARDO
10546;ESCUELA PILAR MOLINER DE NUEZ
10547;ESCUELA REPUBLICA DEL BRASIL
10548;ESCUELA ISABEL RIQUELME
10550;ESCUELA L.GRAL. BERNARDO O´HIGGINS
10551;LICEO POLIV. LUCILA GODOY ALCAYAGA
10553;ESCUELA MARCIAL MARTINEZ FERRARI
10554;ESCUELA GENERAL RENE SCHNEIDER CHEREAU
10555;ESCUELA BASICA BASE EL BOSQUE
10556;ESCUELA ALEMANIA
10557;ESCUELA GENERAL ALBERTO A. BACHELET MARTINEZ
10558;ESCUELA REPUBLICA DE LOS EE.UU. DE AMERICA
10559;ESCUELA BERNARDO LEIGHTON
10560;ESCUELA JAVIERA CARRERA VERDUGO
10561;ESCUELA CLAUDIO ARRAU LEON
10563;ESCUELA MANUEL MAGALLANES MOURE
10564;ESCUELA REPUBLICA DEL PERU
10565;ESCUELA DIEGO PORTALES
10567;ESCUELA MAHUIDA
10568;ESCUELA ORLANDO LETELIER
10569;LICEO NUEVO PORVENIR
10570;ESCUELA BASICA DR LUIS SEPULVEDA SALVATI
10571;ESCUELA ESCRITORA  MARCELA PAZ
10572;LICEO FRAY LUIS BELTRAN
10573;CENTRO EDUCACIONAL MATIAS COUSINO
10574;ESCUELA ESPANA
10576;ESCUELA IGNACIO CARRERA PINTO
10577;ESCUELA DE EDUCACION DIFERENCIAL
10578;ESCUELA STA. TERESA DE LOS MORROS
10579;ESCUELA JOSE NUEZ MARTIN
10580;ESCUELA ABRAHAM LINCOLN
10581;ESCUELA BASICA ANTUPILLAN
10584;LICEO DE ADULTOS PUCARA DE CHENA
10586;ESCUELA ELEODORO YANEZ PONCE DE LEON
10588;ESCUELA CARDENAL ANTONIO SAMORE
10589;ESCUELA HARAS LOS CONDORES
10590;ESCUELA TERESA GARCIA HUIDOBRO
10592;LICEO CLARA SOLOVERA
10594;COLEGIO SAINT ARIELI
10595;ESCUELA BASICA PARTICULAR ROBERTO LORCA
10600;COLEGIO MONTESSORI
10604;COLEGIO VILLA SANTA MARIA
10606;COLEGIO GETSEMANI
10607;COLEGIO DOMINGO EYZAGUIRRE
10608;COLEGIO SUPERIOR DEL MAIPO
10610;COLEGIO SAN JOSE
10618;INSTITUTO SAN PABLO MISIONERO
10619;ESCUELA PARTICULAR JOSE MIGUEL CARRERA
10621;ESCUELA JOSÉ ABELARDO NÚÑEZ N°2
10622;ESCUELA PARTICULAR MARVIT SCHOOL
10623;ESCUELA DIFERENCIAL JUAN SANDOVAL
10625;ESCUELA PARTICULAR MARIA MEDIANERA
10626;COLEGIO JUAN BAUTISTA DURAN
10628;COLEGIO ARAGON
10629;ESCUELA PARTICULAR EL BOSQUE
10631;COLEGIO QUILLAHUE SAN BERNARDO
10632;CENTRO EDUC. DENVER COLORADO SCHOOL
10638;LICEO 131
10640;COLEGIO DE MAIPO
10641;LICEO ALTO JAHUEL
10642;LICEO POLIVALENTE LOS GUINDOS
10643;ESCUELA VILLASECA
10645;LICEO FRANCISCO JAVIER KRUGGER ALVARADO
10646;ESCUELA VALDIVIA DE PAINE
10648;ESCUELA LO SALINAS
10649;ESCUELA HUMBERTO MORENO RAMIREZ
10651;ESCUELA LOS ROSALES DEL BAJO
10652;ESCUELA VILUCO
10655;ESCUELA ESPECIAL DEFIC MENTAL CAMPOSANO
10656;ESCUELA BASICA G-N°813 LOS AROMOS DE EL RECURSO
10658;LICEO POLIVALENTE MODERNO CARDENAL CARO
10660;ESCUELA HOGAR REHABILITACION DON ORIONE
10661;CENTRO DE EDUC.ESPECIAL HNO.BERNARDO
10662;COLEGIO SAINT MARY COLLEGE
10663;CENTRO EDUC. ENRIQUE BERNSTEIN CARABANTE
10665;ESCUELA ALEMANIA
10666;ESCUELA DE HOSPITAL
10667;LICEO  MARIA CARVAJAL FUENZALIDA
10668;ESCUELA ELIAS SANCHEZ ORTUZAR
10669;ESCUELA  BARBARA KAST RIST
10671;ESCUELA CARMEN REVECO NUNEZ
10672;COLEGIO  CHALLAY
10673;ESCUELA BASICA F-N°835 HERMANOS SANCHEZ CERDA
10674;ESCUELA SENDERO DE CULITRIN
10675;ESCUELA  LAS COLONIAS
10676;ESCUELA BASICA G-N°830 FRANCISCO LETELIER VALDES
10677;ESCUELA BASICA G N°831 JAVIER EYZAGUIRRE ECHAURREN
10679;ESCUELA  BASICA G-N°832 AGUILA SUR
10680;ESCUELA HUGO PINO VILCHEZ
10685;COLEGIO PART. MARIA ANA MOGAS
10686;LICEO MUNICIPAL POETISA GABRIELA MISTRAL
10687;ESCUELA BASICA F-N°798 CALERA DE TANGO
10688;LICEO LONQUEN
10689;ESCUELA EL ROTO CHILENO
10692;ESCUELA PARTICULAR SAN IGNACIO
10694;ESCUELA PRESIDENTE PRIETO
10696;LICEO TALAGANTE
10697;LICEO POLITECNICO DE TALAGANTE
10699;ESCUELA REPUBLICA DE GRECIA
10702;ESCUELA MANUEL RODRIGUEZ ERDOIZA
10703;ESCUELA ESTRELLA DE BELEN
10704;ESCUELA ALBORADA DE TALAGANTE
10705;ESCUELA LUIS UNDURRAGA
10706;ESCUELA EL PINO VIEJO DE LONQUEN
10710;COLEGIO ALCANTARA DE TALAGANTE
10711;LICEO COMERCIAL TALAGANTE
10712;ESCUELA BAS. COLEGIO NACIONAL
10713;COLEGIO NINO JESUS
10715;INSTITUTO SUBTTE.LUIS CRUZ MARTINEZ
10716;ESCUELA BAS. BARTOLOME BLUMENTHAL
10717;ESCUELA TECNICA SANTA MARIA MICAELA
10721;ENGLISH COLLEGE
10722;COLEGIO TORREON
10723;COLEGIO PARTICULAR INTEGRAL ARTURO PRAT
10725;CENTRO EDUCACIONAL ISLA DE MAIPO
10726;CENTRO DE EDUCACION MARIO BERTERO CEVASCO
10727;LICEO REPUBLICA DE ITALIA
10729;ESCUELA BASICA EFRAIN MALDONADO TORRES
10730;ESC.BASICA SAN ANTONIO DE NALTAGUA
10734;CENTRO EDUC. PART. MARIA REINA INMACULADA
10735;LICEO POLIV. LUIS HUMBERTO ACOSTA GAY
10736;ESCUELA REPUBLICA DEL ECUADOR
10737;ESC. BASICA  JAVIERA CARRERA VERDUGO
10738;ESCUELA REPUBLICA DE HONDURAS
10740;ESCUELA CHINIGUE EL CRISTO
10741;ESCUELA EL REMANSO
10742;ESCUELA BAS. DIVINA PROVIDENCIA
10743;INSTITUTO SAN FRANCISCO
10744;ESCUELA BAS. COLEGIO EMELINA URRUTIA
10746;LICEO MUNICIPALIZADO PENAFLOR
10747;ESCUELA TERESA DE CALCUTA
10748;ESCUELA EMILIA LASCAR
10749;LICEO PAUL HARRIS
10750;ESCUELA ROSALINA PESCIO VARGAS
10751;LICEO COMERCIAL REPUBLICA DE BRASIL
10752;ESCUELA REPUBLICA ARGENTINA
10753;ESCUELA REPUBLICA CHECA
10754;ESCUELA MAND EDUARDO FREI MONTALVA
10755;ESCUELA ESPECIAL NAZARETH
10756;ESCUELA SONIA PLAZA CASTRO
10757;COLEGIO ALBERTO HURTADO CRUCHAGA
10758;ESCUELA MALLOCO
10760;ESCUELA REPUBLICA DE ISRAEL
10763;ESCUELA CRISTAL CHILE
10764;ESCUELA LA ESPERANZA
10765;ESCUELA BASICA G-N°673 PELVIN SAN FRANCISCO DE ASIS
10766;ESCUELA DOLORES CATTIN FAUNDEZ
10767;ESCUELA BAS. PART. MALLOCO
10768;ESCUELA BASICA N 41 AUGUSTO D`HALMAR
10769;ESC.BASICA PART.BENJAMIN VERGARA
10771;ESCUELA BAS. PART. COLEGIO CLAUDIO GAY
10772;COL.PART.INMAC.CONC. DE NTRA.SRA. DE LOURDES
10773;COMPLEJO EDUC.PART. LUIS PASTEUR
10774;ESCUELA PARTICULAR EL REFUGIO
10778;ESCUELA SAN MIGUEL
10780;LICEO POLIV. HNOS. SOTOMAYOR BAEZA
10781;LICEO POLITECNICO MUNICIPAL MELIPILLA
10782;ESCUELA IGNACIO SERRANO MONTANER
10783;LICEO GABRIELA MISTRAL DE MELIPILLA
10784;COLEGIO HUILCO ALTO
10785;COLEGIO MONS. JAIME LARRAIN BUNSTER
10786;ESCUELA SAN JOSE DE LA VILLA
10789;ESCUELA GRAL. CAROL URZUA
10790;ESCUELA REPUBLICA DEL BRASIL
10791;COLEGIO POMAIRE
10792;LICEO POLIV. EL BOLLENAR
10794;ESCUELA SANTA ROSA ESMERALDA
10795;ESCUELA CLAUDIO ARRAU
10796;ESCUELA PATRICIO LARRAIN GANDARILLAS
10797;ESCUELA PEDRO MARIN ALEMANY
10798;ESCUELA BASICA CARMEN BAJO
10799;ESCUELA RAMON NOGUERA PRIETO
10805;ESCUELA PUANGUE
10810;ESCUELA LIDIA MATTE HURTADO
10816;ESCUELA JOSE CAMARENA ESCRIVA
10818;ESCUELA HUECHUN
10821;ESCUELA RAQUEL FERNANDEZ DE MORANDE
10825;ESCUELA PADRE ALBERTO HURTADO
10827;ESCUELA BASICA EL PABELLON
10828;COLEGIO PARTICULAR ALONSO DE ERCILLA
10829;ESC. BAS. NUESTRA SEÑORA Y MADRE DEL CARMEN
10830;COLEGIO POLITEC.NTRA.SRA.DE LA PRESENTAC
10831;COLEGIO PARTICULAR MELIPILLA
10832;COLEGIO POLIVALENTE SAN AGUSTIN
10833;CENTRO EDUCACIONAL MENESIANO
10835;LICEO MUNICIPAL F-N°860
10836;ESCUELA BASICA F-N° 732 CHOROMBO ALTO
10837;ESCUELA BASICA F-N°738 LOS RULOS
