RBD;NOM_RBD
1;LICEO POLITECNICO ARICA
2;PARVULARIO LAS ESPIGUITAS
3;ESC. PEDRO VICENTE GUTIERREZ TORRES
4;LICEO OCTAVIO PALMA PEREZ
5;JOVINA NARANJO FERNANDEZ
7;L. POLI. ANTONIO VARAS DE LA BARRA
8;COLEGIO INTEGRADO EDUARDO FREI MONTALVA
9;ESCUELA REPUBLICA DE ISRAEL
10;ESCUELA REPUBLICA DE FRANCIA
11;ESC. GRAL. PEDRO LAGOS MARCHANT
12;ESCUELA GRAL JOSE MIGUEL CARRERA
13;ESCUELA MANUEL RODRIGUEZ ERDOYZA
14;ESCUELA ROMULO J. PENA MATURANA
15;LICEO ARTISTICO DR. JUAN NOE CREVANI
16;ESCUELA REGIMIENTO RANCAGUA
17;ESCUELA SUBTTE. LUIS CRUZ MARTINEZ
18;ESC. COMTE. JUAN JOSE SAN MARTIN
19;ESC. HUMBERTO VALENZUELA GARCIA
20;ESCUELA TUCAPEL
22;ESCUELA GABRIELA MISTRAL
25;COLEGIO CENTENARIO DE ARICA
26;ESCUELA REPUBLICA DE ARGENTINA
27;ESCUELA ESMERALDA
28;ESCUELA RICARDO SILVA ARRIAGADA
29;ESCUELA AMERICA
30;ESCUELA DR. RICARDO OLEA GUERRA
31;ESCUELA DARIO SALAS DIAZ
32;LICEO AGRICOLA JOSE ABELARDO NUNEZ M.
33;ESCUELA CARLOS CONDELL DE LA HAZA
35;ESCUELA GRAL. MANUEL BAQUEDANO
36;ESCUELA IGNACIO CARRERA PINTO
38;ESCUELA ESPAÑA
39;ESCUELA PAMPA ALGODONAL
41;ESCUELA VALLE DE CHACA
42;ESCUELA MOLINOS LLUTA
43;JARDIN INFANTIL CEPILLIN
45;COLEGIO ITALIANO SANTA ANA
49;JARDIN INFANTIL PADRE LUIS GALLARDO
50;COLEGIO ADVENTISTA DE ARICA
52;LICEO DOMINGO SANTA MARIA
55;JARDIN INFANTIL MONTESSORI GARDEN
56;COLEGIO SAN MARCOS DE ARICA
60;COLEGIO ALEMAN DE ARICA
66;JARDIN INFANTIL PLUTO
67;ABRAHAM LINCOLN SCHOOL
70;ESCUELA VALLE DE ESQUINA
72;LICEO VALLE DE CODPA
73;ESCUELA VALLE DE COBIJA
74;ESCUELA VALLE DE CAMARONES
75;ESCUELA VALLE DE GUANACAGUA
76;ESCUELA VALLE DE CUYA
78;LICEO GRANADEROS
79;ESCUELA EL MARQUEZ
81;ESCUELA PAYACHATAS
82;ESCUELA SAN FRANCISCO DE ASIS
83;ESCUELA COTA COTANI
84;ESCUELA LOS ALAMOS
86;ESCUELA SAN SANTIAGO DE BELEN
87;ESCUELA ANCOLACANE
88;ESCUELA ALCERRECA
89;ESCUELA HUMAPALCA
90;ESCUELA INTERNADO VISVIRI
91;ESCUELA COSAPILLA
92;ESCUELA CHISLLUMA
93;ESCUELA CHUJLLUTA
94;ESCUELA GUACOYO
95;ESCUELA COLPITAS
97;INST. COM. DE IQUIQUE BALDOMERO WOLNITZKY
102;ESC.EDUC.ESPECIAL FLOR DEL INCA
103;ESC.EDUC.GRAL.BAS.Y DES.ART.VIOLETA PARRA
105;CENTRO DE CAPACITACION LABORAL
106;INSTITUTO DEL MAR ALMIRANTE CARLOS CONDEL
107;LICEO LIBERT. GRAL.BERNARDO O´HIGGINS
108;LICEO POLITEC. JOSE GUTIERREZ DE LA FUEN
109;COLEGIO DEPORTIVO TEC. PROF. ELENA DUVAUCHELLE CABEZON
110;LICEO BICENTENARIO DOMINGO SANTA MARIA DE IQQ.
111;ESCUELA GABRIELA MISTRAL
112;ESCUELA EDUARDO LLANOS
113;ESCUELA ALMIRANTE PATRICIO LYNCH
114;ESCUELA PLACIDO VILLARROEL
116;COLEGIO REPUBLICA DE CROACIA
117;ESCUELA PAULA JARAQUEMADA ALQUIZAR
119;ESCUELA CENTENARIO
122;ESCUELA THILDA PORTILLO OLIVARES
123;COLEGIO ESPANA
124;LICEO LUIS CRUZ MARTINEZ
125;ESCUELA PROFESOR MANUEL CASTRO RAMOS
126;COLEGIO REPUBLICA DE ITALIA
127;LICEO MARIA AUXILIADORA
129;LICEO SUPERIOR GABRIELA MISTRAL
130;COLEGIO NORTH COLLEGE
131;COLEGIO ESCASCE
132;COLEGIO BAJO MOLLE
133;COLEGIO ADVENTISTA DE IQUIQUE
134;LICEO ATENEA
144;COLEGIO IQUIQUE YOUNG SCHOOL
154;ESCUELA BASICA FRONTERIZA
156;ESCUELA PISAGUA
158;ESCUELA CHIAPA
159;ESCUELA JAINA
160;ESCUELA PACHICA
161;LICEO DE HUARA
162;ESCUELA SIBAYA
165;ESCUELA CHUSMIZA
167;ESCUELA CAMINA
168;ESCUELA CUISAMA
169;ESCUELA QUISTAGAMA
170;ESCUELA NAMA
171;ESCUELA APAMILCA
172;ESCUELA CHAPIQUILTA
173;ESCUELA MOQUELLA
174;ESCUELA FRANCIA
175;ESCUELA YALA YALA
177;ESCUELA BASICA CARIQUIMA
178;LICEO TECNICO PROFESIONAL COLCHANE
179;ESCUELA BASICA MAUQUE
185;ESCUELA BASICA PISIGA-CHOQUE
186;ESCUELA BASICA ENQUELGA
187;ESCUELA VERTIENTE DEL SABER
188;ESC. MATILLA DE NUEVA EXTREMADURA
191;LIC. ALCDE.SERGIO GONZALEZ GUTIERREZ
192;ESCUELA BASICA MAMINA
193;ESCUELA BASICA POZO ALMONTE
195;ESCUELA BASICA LA TIRANA
196;ESCUELA BASICA HUATACONDO
198;ESCUELA BASICA LA HUAYCA
199;LICEO DOMINGO LATRILLE LASTAUNOU
200;LICEO POLITECNICO DIEGO PORTALES P.
201;ESCUELA CARLOS CONDELL DE LA HAZA
203;ESCUELA PABLO NERUDA
204;ESCUELA L.GRAL.BERNARDO O´HIGGINS R.
205;ESCUELA ARTURO PRAT CHACON
206;ESCUELA ESTADOS UNIDOS DE NORTEAMERICA
207;ESC. ESPECIAL PEDRO AGUIRRE CERDA
208;COLEGIO SAGRADA FAMILIA
210;ESCUELA ARTURO PEREZ CANTO
211;LICEO H.C. T.P. MARIA ELENA
214;ESCUELA IGNACIO CARRERA PINTO
217;LICEO LUIS CRUZ MARTINEZ
218;LICEO FRANCISCO DE AGUIRRE
219;LICEO POLITECNICO CESAREO AGUIRRE G.
220;LICEO MINERO AMÉRICA
222;CENTRO EDUC.INTEGRAL DE ADULTOS C.E.I.A
223;ESCUELA CLAUDIO ARRAU
224;ESCUELA GRECIA
225;ESCUELA REPUBLICA DE BOLIVIA
226;ESCUELA BASICA EMILIO SOTOMAYOR
227;ESCUELA BASICA PRESIDENTE BALMACEDA
228;ESCUELA BASICA VADO DE TOPATER
229;ESCUELA REPUBLICA DE CHILE
230;ESCUELA BASICA ANDRES BELLO
231;ESCUELA BASICA JOHN FITZGERALD KENNEDY
232;ESCUELA BASICA PEDRO VERGARA KELLER
236;ESCUELA DE PARVULOS LAS ABEJITAS
237;ESCUELA DE PARVULOS LLAMITO BLANCO
238;ESCUELA DIFERENCIAL LOA
239;ESCUELA BASICA 21 DE MAYO
240;ESCUELA BASICA REPUBLICA DE FRANCIA
241;ESCUELA PARVULARIA LAS ARDILLAS
243;ESCUELA BASICA PUKARA
244;ESCUELA DE PARVULOS LOS ENANITOS
245;ESCUELA DE PARVULOS PAPELUCHO
246;ESCUELA BASICA SENORA DE LA CANDELARIA
248;ESCUELA BASICA SAN JOSE
252;ESCUELA BASICA SAN FRANCISCO
253;COLEGIO ADVENTISTA DE CALAMA
254;FUNDACION EDUC.COLEGIO NUESTRA SRA.DE AYQUINA
255;COLEGIO EJERCITO DE SALVACION
256;INSTITUTO OBISPO SILVA LEZAETA
262;ESCUELA DE PARVULOS MICKEY MOUSE
265;ESCUELA DE PARVULOS LOS CONEJITOS
268;ESC. BASICA RURAL SAN ANTONIO DE PADUA
269;ESCUELA BASICA SAN PEDRO DE ATACAMA
270;COMPLEJO EDUCACIONAL TOCONAO
271;ESCUELA BASICA CAMAR
273;ESCUELA BASICA SOLOR
274;ESCUELA BASICA SAN ROQUE
275;ESCUELA BASICA ANDINA
276;ESCUELA BASICA TALABRE
277;ESCUELA BASICA SAN BARTOLOME
279;LICEO INDUSTRIAL EULOGIO GORDO MONEO
280;LICEO COMERCIAL JERARDO MUNOZ CAMPOS
282;LICEO A. RENDIC I. ANEXO C. REHABILIT. SOCIAL
283;LICEO TECNICO ANTOFAGASTA
284;LICEO DE HOMBRES DE ANTOFAGASTA MARIO BAHAMONDE SILVA
285;LICEO MARTA NAREA DIAZ
286;LICEO LA PORTADA
287;LICEO DOMINGO HERRERA RIVERA
288;ESCUELA JAPON
289;ESCUELA ESPANA
291;ESCUELA PADRE GUSTAVO LE PAIGE WALQUE
292;ESCUELA REPUBLICA DE ITALIA
293;ESCUELA JOSE PAPIC RADNIC
294;ESCUELA PROFESORA LJUBICA DOMIC WUTH
296;ESCUELA REPUBLICA DE LOS ESTADOS UNIDOS
297;ESCUELA ALCALDE MAXIMILIANO POBLETE
298;ESCUELA DARIO SALAS DIAZ
301;ESCUELA ROMULO J. PENA MATURANA
302;ESCUELA JUAN LOPEZ
303;ESCUELA REPUBLICA ARGENTINA
304;LICEO BICENTENARIO ANDRES SABELLA
305;ESCUELA HUMBERTO GONZALEZ ECHEGOYEN
306;ESCUELA HUANCHACA
307;ESCUELA DE PARVULOS MARCELA PAZ
310;ESCUELA CLAUDIO MATTE PEREZ
311;ESC DIFERENCIAL JUAN SANDOVAL CARRASCO
312;ESCUELA ECUADOR
313;ESCUELA ARTURO PRAT
315;ESCUELA HEROES DE LA CONCEPCION
316;ESCUELA LAS AMERICAS PROFESOR JUSTO VALLADARES ORELLANA
317;ESCUELA LAS ROCAS
318;ESCUELA EDDA CUNEO DONNAGIO
319;ESCUELA LA BANDERA
320;LICEO ARTISTICO DE ANTOFAGASTA `ARMANDO CARRERA GONZALEZ`
322;ESCUELA GENERAL MANUEL BAQUEDANO
324;ESCUELA FUNDACION MINERA ESCONDIDA
326;ESCUELA SANTIAGO AMENGUAL B.
329;INSTITUTO CIENTÍFICO EDUCACIONAL JOSÉ MAZA SANCHO
330;ESCUELA DE PARVULOS LOS PINGUINITOS
332;ESCUELA GABRIELA MISTRAL
333;ESCUELA DE PARVULOS BLANCA NIEVES
335;COLEGIO MISIONERO JOSE LANCASTER
336;LICEO EXPERIMENTAL ARTISTICO-APLICACION
337;COLEGIO SANTA TERESITA
340;CENTRO TRATAMIEN.INTEGRAL RAYITO DE SOL
341;COLEGIO ADVENTISTA DE ANTOFAGASTA
342;COLEGIO INGLES SAN JOSE
343;ESCUELA PRESBITERIANA
344;COLEGIO SANTA EMILIA
350;COLEGIO LIDIA MORENO
356;COLEGIO CORAZON DE MARIA
365;COLEGIO EAGLE SCHOOL
367;COMPLEJO EDUCATIVO JUAN JOSE LATORRE BENAVENT
368;ESCUELA BASICA JULIA HERRERA VARAS
369;ESCUELA LUCILA GODOY ALCAYAGA
370;ESCUELA ESTACION BAQUEDANO
371;ESCUELA CARACOLES
372;LICEO POLITECNICO JOSE MIGUEL QUIROZ
373;LICEO JUAN CORTES-MONROY CORTES
374;ESCUELA HOGAR VICTORIANO QUINTEROS SOTO
375;ESCUELA VICTOR CARVAJAL MEZA
377;ESCUELA PARANAL
379;LICEO FEDERICO VARELA
380;ESCUELA BASICA DIEGO PORTALES PALAZUELOS
381;ESCUELA BASICA PEDRO LUJAN
382;ESCUELA BASICA GASPAR CABRALES
383;ESC. BAS. DIFERENCIAL JOSE LUIS OLIVARES A.
384;LICEO BICENTENARIO  MANUEL MAGALHAES MEDLING
386;ESCUELA ALIRO LAMAS CASTILLO
387;ESC. BASICA EMPERATRIZ SEPULVEDA LANDEROS
390;ESCUELA COEDUCACIONAL PARTICULAR
392;LICEO DIEGO DE ALMEIDA
396;INSTITUTO COMERCIAL ALEJANDRO RIVERA DIAZ
397;LICEO TÉCNICO PROFESIONAL EDWIN LATORRE RIVERO
399;LICEO JOSE ANTONIO CARVAJAL
400;LICEO MERCEDES FRITIS MACKENNEY
401;ESCUELA BERNARDO O HIGGINS
403;ESCUELA LAURA ROBLES SILVA
404;ESC.EDUC.DIFERENCIAL MARIA LUZ LANZA PIZARRO
405;ESCUELA LOS ESTANDARTES
406;ESCUELA VICENTE SEPULVEDA ROJO
407;ESCUELA JESUS FERNANDEZ HIDALGO
408;ESCUELA PEDRO LEON GALLO
410;ESCUELA JOSE MANSO DE VELASCO
411;ESCUELA LAS CANTERAS
413;ESCUELA LAS BRISAS
415;LICEO DE MÚSICA DE COPIAPÓ HUGO GARRIDO GAETE
416;ESCUELA ABRAHAM SEPULVEDA PIZARRO
417;COLEGIO BUEN PASTOR
418;ESCUELA ISABEL PENA MORALES
419;ESCUELA HERNAN MARQUEZ HUERTA
420;LICEO FERNANDO ARIZTÍA RUIZ
421;ESCUELA BRUNO ZAVALA FREDES
423;ESCUELA SAN PEDRO
427;ESCUELA LUIS CRUZ MARTINEZ
429;LICEO CATOLICO ATACAMA
430;LICEO POLITECNICO BELEN
431;LICEO SAGRADO CORAZON
433;COLEGIO ADVENTISTA DE COPIAPO
434;ESCUELA SAN VICENTE DE PAUL
437;ESCUELA TECNICO PROFESIONAL
438;LICEO MANUEL BLANCO ENCALADA
439;ESCUELA TOTORAL
440;COLEGIO PARROQUIAL PADRE NEGRO
441;ESCUELA DE CONCENTRACION
442;ESCUELA VICTOR MANUEL SANCHEZ CABANAS
444;ESCUELA LUIS URIBE ORREGO
445;ESCUELA PAUL HARRIS
446;ESCUELA AMOLANAS
447;ESCUELA SAN ANTONIO
448;LICEO PEDRO TRONCOSO MACHUCA
449;LICEO JOSE SANTOS OSSA
450;ESCUELA HERMANOS CARRERA
452;ESCUELA GABRIELA MISTRAL
453;ESCUELA IGNACIO CARRERA PINTO
454;ESCUELA GREGORIO CASTILLO MARÍN
455;ESCUELA REPUBLICA DE LOS E.E.U.U.
456;ESC. EDUC.DIFERENC LUIS IRIARTE IRIARTE
458;ESCUELA ARTURO PEREZ CANTO
459;ESCUELA BASICA ESPANA
461;ESCUELA LUIS CRUZ MARTINEZ
462;ESCUELA JOSE CAROCA LAFLOR
463;ESCUELA BASICA ROBERTO CUADRA ALQUINTA
464;ESCUELA BASICA GUALBERTO KONG FERNANDEZ
467;ESCUELA HERNAN ARAVENA CONTRERAS
468;ESCUELA BASICA IGNACIO FRANCO GALLO
469;ESCUELA BASICA JUSTINO LEIVA AMOR
471;ESCUELA BASICA SARA BEMBOW VILLEGAS
476;ESCUELA BASICA SOR TERESA DE LOS ANDES
478;LICEO SANTA MARTA
479;LICEO SAN FRANCISCO
481;ESCUELA BASICA ALEJANDRO NOEMI HUERTA
482;ESCUELA FORTUNATO SOZA RODRIGUEZ
483;ESCUELA SAMUEL E. CASTILLO LOPEZ
484;ESCUELA DE MAITENCILLO
485;ESCUELA BASICA YERBAS BUENAS
486;LICEO JAPON
487;ESCUELA BASICA JOSE MIGUEL CARRERA
489;ESCUELA EL OLIVAR
490;ESCUELA PABLO NERUDA
492;COLEGIO PARTICULAR ENGLISH COLLEGE
493;EDUCADOR ARTURO ALVEAR RAMOS
495;ESCUELA AGLADE MARIN VARGAS
496;ESCUELA DE CHOLLAY
497;ESCUELA DE LA PAMPA
498;ESCUELA ALGARROBILLA
499;ESCUELA RICARDO CAMPILLAY CONTRERAS
500;ESCUELA BASICA RURAL EL TAMBO
502;ESCUELA DE LAS MARQUESAS
503;ESCUELA DE LAS BREAS
504;ESCUELA GABRIELA MISTRAL
506;ESCUELA DE LOS PERALES
508;ESCUELA DE CHIGUINTO
514;ESCUELA DE EL CORRAL
516;LICEO GABRIELA MISTRAL DE LA SERENA
517;LICEO GREGORIO CORDOVEZ
518;LICEO TECNICO MARTA BRUNET
519;COLEGIO ARTURO PRAT CHACON
521;COLEGIO VICTOR DOMINGO SILVA
522;COLEGIO JAVIERA CARRERA
523;ESCUELA ALONSO DE ERCILLA
525;COLEGIO JAPON
526;COLEGIO JOSE MANUEL BALMACEDA
527;COLEGIO HEROES DE LA CONCEPCION
528;ESCUELA GERMAN RIESCO
529;COLEGIO MANUEL RODRIGUEZ
530;COLEGIO GABRIEL GONZALEZ VIDELA
531;COLEGIO PEDRO AGUIRRE CERDA
532;CEN.ED.INT.DE ADUL.ESTER VILLARREAL CASTILLO
533;COLEGIO DARIO SALAS
534;COLEGIO VILLA SAN BARTOLOME
535;COLEGIO JOSE MIGUEL CARRERA
536;COLEGIO BERNARDA MORIN
537;COLEGIO LUIS BRAILLE
539;COLEGIO DE ALGARROBITO
540;ESCUELA DE ISLON
542;ESCUELA DE LAMBERT
543;COLEGIO ALTOVALSOL
544;ESCUELA DE EL MILAGRO
546;COLEGIO COQUIMBITO
548;ESCUELA DE COLONIA ALFALFARES
549;ESCUELA DE LOS CORRALES
550;ESCUELA DE ALMIRANTE LATORRE
551;ESCUELA DE LAS ROJAS
552;ESCUELA DE CHACAY ALTO
554;ESCUELA DE PELICANA
556;ESCUELA DE ROMERO
557;ESCUELA DE SATURNO
558;COLEGIO PUNTA DE TEATINOS
560;COLEGIO QUEBRADA DE TALCA
561;COLEGIO EL ROMERAL
562;COLEGIO CALETA SAN PEDRO
563;COLEGIO LA LAJA
564;COLEGIO LA ESTRELLA
565;COLEGIO ADVENTISTA LA SERENA
566;COLEGIO ISABEL RIQUELME
567;COLEGIO SAN FRANCISCO COLL
568;COLEGIO SAN ANTONIO
570;COLEGIO ELENA BETTINI
571;ESC.ESPEC.LOS PENSAMIENTOS DE JUAN XXIII
573;ESCUELA PARTICULAR TERESA VIDELA DE G
574;ESCUELA INDUSTRIAL SALESIANA SAN RAMON
575;COLEGIO PROVIDENCIA
578;LICEO IGNACIO CARRERA PINTO
579;COLEGIO SEMINARIO CONCILIAR
581;ESCUELA EXPERIMENTAL DE MUSICA JORGE PEÑA HEN
583;COLEGIO SAGRADOS CORAZONES
589;COLEGIO SANTO DOMINGO
597;COLEGIO PEDRO PABLO MUÑOZ
598;ESCUELA DE PUNTA DE CHOROS
599;ESCUELA JOSE SANTOS OSSA
602;ESCUELA BASICA CARLOS CONDELL
604;ESCUELA DE PUNTA COLORADA
606;ESCUELA BASICA SAN ANDRES
608;ESCUELA DE LOS CHOROS
609;INSTITUTO SUPERIOR DE COMERCIO DE COQUIMBO
610;LICEO INDUSTRIAL JOSE TOMAS DE URMENETA
611;LICEO DIEGO PORTALES
612;ESCUELA GUILLERMO CERECEDA
613;COLEGIO DE ARTES CLAUDIO ARRAU
614;ESCUELA PRESIDENTE ANIBAL PINTO
615;ESCUELA COQUIMBO
616;ESCUELA CARDENAL JOSE MARIA CARO
617;COLEGIO SANTA CECILIA
618;ESCUELA SANTO TOMAS DE AQUINO
620;ESCUELA JOSE ALFARO ALFARO
621;ESCUELA BASICA MARIO MUNOZ SILVA
623;CENTRO LABORAL JEAN PIAGET
624;ESCUELA DIFERENCIAL JUAN SANDOVAL C.
625;ESCUELA TOMASA OLIVARES CAAMANO
626;ESCUELA BASICA DAVID LEON TAPIA
628;ESCUELA DE PENUELAS
629;COLEGIO PABLO NERUDA
630;COLEGIO LA HERRADURA
631;ESCUELA SAN RAFAEL
632;ESCUELA BASICA MANUEL DE SALAS
634;ESCUELA DE HUACHALALUME
635;ESCUELA DE TOTORALILLO
637;ESCUELA LUCILA GODOY ALCAYAGA
638;ESCUELA DE CAMARONES
639;ESCUELA DE LAS BARRANCAS
640;ESCUELA DE EL MOLLACO
641;ESCUELA DE LAS CARDAS
642;ESCUELA DE EL PENON
643;ESCUELA DE TAMBILLOS
644;ESCUELA DE PUERTO ALDEA
645;ESCUELA DE EL TANGUE
646;COLEGIO BERNARDO O´HIGGINS
647;COLEGIO MANUEL MONTT
648;COLEGIO SANTA MARTA
649;COLEGIO PARTICULAR GABRIELA MISTRAL
650;ESCUELA PARTICULAR METODISTA
655;COLEGIO PARTICULAR SAN IGNACIO
656;LICEO PEDRO REGALADO S. VIDELA O.
657;ESCUELA LUIS CRUZ MARTINEZ
658;ESCUELA PATRICIO LYNCH
659;ESCUELA PADRE BLAS HERNANDEZ SANCHEZ
661;ESCUELA LUIS AMENABAR OSSA
662;ESCUELA DE MAITENCILLO
664;COLEGIO PARROQUIAL DE ANDACOLLO
665;LICEO CARLOS ROBERTO MONDACA CORTES
666;ESCUELA BASICA LUCILA GODOY ALCAYAGA
668;ESCUELA EDMUNDO VIDAL CARDENAS
669;ESCUELA NEFTALI REYES
671;ESCUELA RIOS DE ELQUI
672;ESCUELA DE DIAGUITAS JUAN TORRES M.
673;ESCUELA JOSE ABELARDO NUNEZ
674;ESCUELA DE VINITA ALTA
676;ESCUELA DE SAN CARLOS
678;ESCUELA AMELIA BARAHONA MUJICA
680;ESCUELA FEDERICO BARNES PAYNE
681;ESCUELA DE EL ARENAL
682;ESCUELA DAGOBERTO CAMPOS NUNEZ
683;ESCUELA DE LA CALERA
686;ESCUELA BÁSICA MARIO AQUILES RODRIGUEZ
687;ESCUELA DE HUANTA
688;ESCUELA DE CHAPILCA
689;ESCUELA DE VARILLAR
690;COLEGIO ANTONIO VARAS
691;ESCUELA MUNICIPAL CIELO CLARO--PAIHUANO
692;ESCUELA JERONIMO GODOY VILLANUEVA
693;ESCUELA MUNICIPAL QUEBRADA DE PAIHUANO
694;ESCUELA GABRIELA MISTRAL
695;ESCUELA MUNICIPAL TRES CRUCES
696;ESCUELA MUNICIPAL LA ORTIGA
697;ESCUELA MUNICIPAL ALCOHUAZ
699;ESCUELA MARIA ISABEL PERALTA P.
701;LICEO ESTELA AVILA DE PERRY
704;LICEO ALEJANDRO ALVAREZ JOFRE
705;LICEO POLITECNICO DE OVALLE
706;COLEGIO FRAY JORGE
707;ESCUELA BASICA HELENE LANG
708;ESCUELA ANTONIO TIRADO LANAS
709;ESCUELA BASICA OSCAR ARAYA MOLINA
710;ESCUELA BASICA JOSE TOMAS OVALLE B.
711;ESCUELA GUARDIAMARINA ERNESTO RIQUELME V
712;ESCUELA BÁSICA ARTURO ALESSANDRI PALMA
713;ESCUELA ARTURO VILLALON SIEULANNE
714;ESCUELA BASICA VISTA HERMOSA
715;ESCUELA BASICA BERNARDO O¦HIGGINS RIQUELME
716;ESC.PADRE JOSEPH BENEDIKT STEGMEIER
718;ESCUELA MARCOS MACUADA OGALDE
719;COLEGIO YUNGAY
721;ESCUELA BASICA FLORENCIO ESPINOZA LOPEZ
722;ESC. HEBERTO VELAZQUEZ VELAZQUEZ
723;ESCUELA VILLORRIO EL TALHUEN
724;ESCUELA BASICA CALETA EL MAITEN
725;ESCUELA EL CRISOL
726;ESCUELA QUEBRADA SECA DE SOTAQUI
727;ESCUELA LA PALOMA
728;ESCUELA EL ALGARROBO
729;ESCUELA BASICA LOS OLIVOS
730;ESCUELA BASICA LUCIA NUNEZ DE LA CUADRA
731;ESCUELA EL TRAPICHE
733;ESCUELA PADRE DAMIAN HEREDIA
735;ESCUELA LA QUIROGA
736;ESCUELA BASICA LOS SOSSAS
737;ESCUELA BASICA VALENTIN LETELIER
740;ESCUELA PEDRO ENRIQUE ALFONSO BARRIOS
743;ESCUELA CARACHILLA
744;ESCUELA ORURO
745;ESCUELA LA HIGUERA DE PALOMA
746;ESCUELA EL SAUCE
747;ESCUELA CERRO TAMAYA
749;ESCUELA TRANQUE RECOLETA
750;ESCUELA ELVIRA DEL CARMEN OCHOA AVILES
752;ESCUELA VALLE HERMOSO
753;ESC.BAS.JUAN PABLO ARTIGUES PENAFIEL
754;ESCUELA LA ARAUCANA
755;ESCUELA CANELILLA
756;ESCUELA SANTA CATALINA
757;ESCUELA BASICA EL GUINDO
758;ESCUELA CORDILLERA
759;ESCUELA BASICA GASPAR CABRALES
760;ESCUELA LAS LOMAS DE PUNILLA
762;ESCUELA CALETA EL TORO
763;COLEGIO SAN JUAN BAUTISTA
766;COLEGIO SANTA MARIA EUFRASIA
767;COLEGIO PARTICULAR GABRIELA MISTRAL
768;COLEGIO LA PROVIDENCIA
769;COLEGIO SAN VIATOR
771;ESCUELA PARTICULAR EL ARRAYAN
772;LICEO AGRICOLA DE OVALLE TADEO PERRY BARN
773;ESCUELA SAMO ALTO
774;COLEGIO PICHASCA
775;ESCUELA BASICA DE FUNDINA
776;ES.BAS.SAN PEDRO DE RIO HURTADO
777;ESC.BASICA HIJOS DE EL CHANAR
778;ESCUELA BASICA LAS BREAS
780;ESCUELA BASICA TABAQUEROS
783;ESCUELA DOCTOR JOSE LUIS ARRANO
784;ESCUELA BASICA HUAMPULLA
785;ESCUELA BASICA LOS MAITENES DE SAMO ALTO
786;ESCUELA BASICA LA HUERTA
787;ESCUELA BASICA MORRILLOS
788;ESCUELA BASICA VADO DE MORRILLOS
789;ESCUELA EL ESPINAL DE RIO HURTADO
790;ESCUELA BASICA EL ROMERAL
792;ESCUELA BASICA ESTANCIA EL SAUCE
793;ESCUELA BASICA DE SERON
795;ESC.BASICA DOMINGO SANTA MARIA GONZALEZ
797;ESCUELA LOS MAITENES DE SERON
798;ESCUELA EL PALQUI
799;COLEGIO REPUBLICA DE CHILE
800;ESCUELA HUATULAME
802;LICEO PRESIDENTE EDUARDO FREI MONTALVA
803;ESC.CONCENTRACION FRONTERIZA DE TULAHUEN
804;ESCUELA BASICA WENCESLAO VARGAS
805;ESCUELA EL MAQUI
806;ESCUELA FRONTERA LAS RAMADAS
807;ESCUELA EL MAITEN
809;ESCUELA DE HUANILLA
810;ESCUELA CENTRAL HIDROELECTRICA LOS MOLLE
812;ESCUELA SOL DE LAS PRADERAS
813;ESCUELA BASICA LA UNION
814;ESCUELA BASICA EL TAYAN
816;ESCUELA GUSTAVO CONTRERAS CASTRO
817;ESCUELA NUEVA ESPERANZA DE PEJERREYES
818;ESCUELA LOS CLONQUIS
819;ESCUELA BUENAVENTURA
820;ESCUELA SOL DEL CUYANO
821;ESCUELA DE FLOR DEL VALLE
822;ESCUELA JUNTAS
823;ESCUELA BASICA COLLIGUAY
824;ESCUELA HEROES DE CHILE
825;ESCUELA BASICA PABLO NERUDA
826;ESCUELA BASICA HACIENDA VALDIVIA
827;COLEGIO RIO GRANDE
830;ESCUELA MARCELA PAZ
833;ESCUELA SANTA BERNARDITA
835;ESCUELA CARMELA PRAT
836;ESCUELA INES DE SUAREZ
837;ESCUELA ESPERANZA DE HUANA
838;ESCUELA PROFESOR MANUEL ORTIZ QUINTANA
839;ESCUELA CHILECITO
843;ESCUELA LOS PERALES DE CAMPANARIO
844;ESCUELA PARTICULAR CERRILLOS DE RAPEL
845;LICEO SAMUEL ROMAN ROJAS
847;ESCUELA BASICA AMERICA
848;ESCUELA ALEJANDRO CHELEN ROJAS
849;ESCUELA BASICA JUANITA FERNANDEZ SOLAR
850;ESCUELA JUAN LUIS SAN FUENTES
851;ESCUELA BASICA ARTURO PEREZ CANTO
852;ESCUELA BASICA PEDRO DE VALDIVIA
857;ESCUELA LOS MORALES
859;ESCUELA REBECA MATTE DE INIGUEZ
862;ESCUELA ESTRELLA DE BELEN
864;ESCUELA BASICA VIOLETA PARRA SANDOVAL
865;ESCUELA BASICA DANIEL BARROS GREZ
868;ESCUELA AMERICA DE SUR
869;ESCUELA BASICA REBECA PONCE DE LEON V.
870;ESCUELA BASICA CAMILO HENRIQUEZ GONZALEZ
871;ESCUELA BASICA LUIS ENRIQUE BOU PEREZ
872;ESCUELA BASICA ROSITA OHIGGINS
874;ESCUELA BASICA LAURITA VICUNA
875;ESCUELA BASICA PEDRO LIRA RENCORET
876;ESCUELA BASICA CLAUDIO MATTE
879;ESCUELA BASICA BENJAMIN VICUNA MACKENNA
883;ESCUELA BASICA SAN LUIS AMIGO Y FERRER
884;ESCUELA BASICA JUAN FRANCISCO GONZALEZ
886;ESCUELA LA VARIOLA
887;ESCUELA BASICA CAUPOLICAN
888;ESCUELA BASICA BOSQUE DE QUILLAY
890;ESCUELA PARTICULAR LOS SAPOS
891;ESCUELA PARTICULAR RINCON DE LAS CHILCAS
892;ESCUELA PARTICULAR EL DURAZNO
896;ESCUELA PARTICULAR LA COLORADA
897;ESCUELA BELGICA
899;ESCUELA LUZ DE LUNA
900;ESCUELA BASICA LA HIGUERA DE QUILE
902;ESCUELA BASICA ELENA CAFFARENA
904;ESCUELA CAMPO LINDO
905;ESCUELA CHALINGA
906;ESCUELA LOS CANELOS
907;ESCUELA HIJOS DEL PERAL
908;ESCUELA TABALI
909;ESCUELA LOS AZAHARES DE CERRO BLANCO
910;ESC.BASICA SAN ANTONIO DE LA VILLA
911;ESCUELA LOS TRIGOS
914;ESCUELA PENA BLANCA
915;ESCUELA MARCOS RIGOBERTO PIZARRO ARAYA
916;ESCUELA BARRAZA BAJO
917;ESCUELA RINCON DE LA CALERA
923;ESCUELA EL MAQUI DE QUILE
924;ESCUELA LOS ACACIOS
925;ESCUELA BASICA VILLA LOS QUILES
928;ESCUELA BASICA GRANEROS
929;ESCUELA LOS NOGALES
931;ESCUELA SAN ANTONIO DE PADUA
932;ESCUELA UNION CAMPESINA
933;ESCUELA LAS CRUCES
934;ESCUELA BEATRIZ VEGA VEGA
935;ESCUELA SALALA
936;ESCUELA EL ESPINAL
937;ESCUELA ALCONES BAJOS
939;ESCUELA ALMENDRO DE QUILE
940;ESCUELA SAN PEDRO
943;ESCUELA PADRE PABLO DIEHL HARTMAN
945;ESCUELA SOL NACIENTE
946;ESCUELA TERESITA DE LOS ANDES
947;ESCUELA AURORA DE CHILE
948;ESCUELA BASICA LAS AGUILAS
949;ESCUELA EL DURAZNO DE QUILE
950;ESCUELA LA CEBADAS
951;ESCUELA LA CALERA DE SAN JULIAN
952;ESCUELA BASICA LOS CIENAGOS
953;ESCUELA PATRICIO ZEBALLOS
954;ESCUELA EL AJIAL DE QUILE
955;ESCUELA VILLA LOS CORRALES
956;ESCUELA PORTEZUELOS BLANCOS
957;ESCUELA EL CIENAGO
959;COLEGIO PARTICULAR SALI HOCHSCHILD
960;ESCUELA PARTICULAR EL LLANITO
962;ESCUELA ALGARROBO DE HORNILLOS
963;ESCUELA PARTICULAR EL TENIENTE
964;ESCUELA BASICA MUNICIPAL DE ADULTOS
967;LICEO DOMINGO ORTIZ DE ROZAS
968;LICEO POLITECNICO PABLO RODRIGUEZ CAVIEDES
969;ESCUELA BASICA VALLE DEL CHOAPA
970;ESCUELA JUAN CARRASCO RISCO
971;ESCUELA BASICA SAN RAFAEL DE ROZAS
972;ESCUELA BASICA JORGE ARACENA RAMOS
973;ESCUELA BASICA CLEMENCIA VILLARROEL
974;ESCUELA BASICA CAMILO HENRIQUEZ
976;ESCUELA BASICA LAS PALMERAS DE LIMAHUIDA
977;ESCUELA BASICA GRACIELA DIAZ ALLENDE
978;ESCUELA BASICA MATANCILLA
981;ESCUELA BASICA CHOAPA LINDO
982;ESCUELA BASICA VILLA LOS NARANJOS
984;ESCUELA BASICA TUNGA SUR
985;ESCUELA BASICA ASIENTO VIEJO
986;ESCUELA BASICA LAS CHINCHILLAS DE COCOU
987;COLEGIO SANTA TERESA
988;LICEO PARTICULAR LUIS ALBERTO VERA
990;ESCUELA PARTICULAR LAS CANAS
991;ESCUELA PARTICULAR QUEBRADA EL PERAL
993;ESCUELA PARTICULAR CANELILLO ALTO
994;ESCUELA PARTICULAR RINCON DEL ROMERO
995;ESCUELA PARTICULAR CAREN
996;ESCUELA PARTICULAR EL LANCO
998;ESCUELA PARTICULAR ILTA
999;ESCUELA PARTICULAR 18 DE SEPTIEMBRE
1001;ESCUELA PARTICULAR HERMINIA RAMOS
1002;ESCUELA PARTICULAR EL SOCAVON
1004;ESCUELA PARTICULAR LA CAPILLA
1005;ESCUELA PARTICULAR RINCON DE TUNGA
1006;ESCUELA MANUEL JOSE IRARRAZAVAL
1008;ESCUELA PARTICULAR QUILLAICILLO
1010;ESCUELA PARTICULAR CUYUNTAGUA
1011;ESCUELA PARTICULAR MACUCO
1013;LICEO DE SALAMANCA
1014;ESCUELA MATILDE SALAMANCA
1015;ESCUELA BASICA DIAGUITAS DE CHALINGA
1016;ESCUELA TRANQUILLA
1017;ESCUELA BASICA BERTA HIDALGO BARAHONA
1018;ESCUELA EL TAMBO
1019;ESCUELA BASICA CHILLEPIN
1020;ESCUELA BASICA GUISELA GAMBOA SALINAS
1021;ESCUELA ZAPALLAR
1022;ESCUELA COIRON
1027;ESCUELA BASICA QUELEN BAJO
1030;ESC.BASICA GUILLERMO BARRIOS VARGAS
1031;ESCUELA BASICA JULIO ECHAVARRIA
1032;ESCUELA BASICA SAN AGUSTIN
1033;ESCUELA BASICA PANGUESILLO
1034;ESCUELA LOS CORRALES
1036;COLEGIO PARTICULAR SAN FRANCISCO DE ASIS
1037;ESCUELA PARTICULAR HUANQUE
1038;ESCUELA PARTICULAR EL PALQUIAL
1040;ESCUELA PARTICULAR LAS JARILLAS
1041;ESCUELA PARTICULAR CAJON DE QUELEN
1042;ESCUELA MUNICIPAL COLLIGUAY
1044;ESCUELA PARTICULAR MANQUEHUA
1045;ESCUELA PARTICULAR PUNTA NUEVA
1046;ESCUELA PARTICULAR PLANTA PELADEROS
1047;ESCUELA PARTICULAR VALLE CAMISAS
1048;LICEO NICOLAS FEDERICO LOHSE VARGAS
1049;COLEGIO DIEGO DE ALMAGRO
1050;ESCUELA BASICA ERCOLE BENCINI
1051;ESCUELA BASICA TERESA CANNON DE B.
1052;ESCUELA BASICA PABLO BARRIOLHET
1053;ESCUELA BASICA FORJADORES DE CHILE
1055;ESCUELA LOS MAQUIS
1059;ESCUELA CLARA VIAL ORREGO
1061;ESCUELA TILAMA
1062;ESC.PDTE.FEDERICO ERRAZURIZ ECHAURREN
1063;ESCUELA
1064;ESCUELA BASICA EL QUELON
1065;ESCUELA BASICA EL MANZANO
1066;ESCUELA PARTICULAR DIVINA PROVIDENCIA
1068;ESCUELA PARTICULAR CULIMO
1069;ESCUELA PARTICULAR MINA LAS VACAS
1071;ESCUELA PARTICULAR EL ROMERO
1072;ESCUELA PARTICULAR INFIERNILLO
1076;ESCUELA PARTICULAR MAIMALICAN
1077;ESCUELA BASICA HECTOR JORQUERA VALENCIA
1078;ESCUELA BASICA JUAN ANTONIO RIOS
1082;ESC.BASICA MERCEDES MARIN DEL SOLAR
1083;ESCUELA BASICA CARQUINDANO
1084;ESCUELA BASICA JABONERIA
1087;ESCUELA BASICA CANELA ALTA
1092;ESCUELA BASICA MINCHA NORTE
1093;ESCUELA BASICA ATELCURA ALTA
1094;ESCUELA BASICA POZA HONDA
1095;ESCUELA BASICA SARGENTO ALDEA
1096;ESCUELA BASICA LOS POZOS
1099;ESCUELA VIOLETA PARRA
1100;ESC.BASICA CARLOS VIAL ESPANTOSO
1101;ESCUELA BASICA JOSE MIGUEL CARRERA
1102;ESCUELA BASICA BALDOMERO LILLO FIGUEROA
1104;ESCUELA LA CORTADERA
1108;ESCUELA BASICA MARTA BRUNETT
1109;ESCUELA BASICA GABRIELA MISTRAL
1113;ESCUELA BASICA SALVADOR REYES
1114;ESCUELA PARTICULAR EL CHILCAL
1116;ESCUELA PARTICULAR CANELILLA
1117;ESCUELA PARTICULAR LOS TOMES
1119;COLEGIO PARTICULAR SANTA MARIA
1120;CENTRO DE EDUCACION DE ADULTOS LA LIGUA
1121;LICEO PULMAHUE DE LA LIGUA
1122;ESCUELA REPUBLICA DE VENEZUELA
1123;ESCUELA GABRIELA MISTRAL
1125;ESCUELA DIEGO PORTALES
1126;ESCUELA ESPECIAL SOL NACIENTE
1128;ESCUELA COMUNIDADES DE VALLE HERMOSO
1129;ESCUELA ANGEL MENAY
1130;ESC. BASICA LOS HORNOS DE HUAQUEN
1131;ESC. BASICA CASAS VIEJAS DE LONGOTOMA
1132;ESCUELA BASICA POZA VERDE
1133;ESC.BASICA LAS CASAS DE HUAQUEN
1134;CARMEN SANCHEZ ARAYA
1135;ESCUELA BASICA LOS MOLLES
1136;ESCUELA BASICA PUYANCON
1137;ESCUELA BASICA HORTENCIA POWELL S.
1139;ESCUELA MINISTRO GOMEZ MILLAS
1140;ESCUELA BASICA CARLOS ARIZTIA RUIZ
1142;ESCUELA LA CANELA
1143;ESCUELA BASICA QUEBRADILLA
1144;ESCUELA BASICA PICHICUY
1145;ESCUELA ENRIQUE DOLL ROJAS
1147;ESCUELA FERNANDO GARCIA OLDINI
1148;LICEO JOSE MANUEL BORGONO NUNEZ
1149;LICEO CORDILLERA
1150;ESCUELA BASICA NEFTALI REYES B.
1151;ESCUELA BASICA VILLA SANTA ANA
1152;ESCUELA EDUARDO FREI MONTALVA
1153;ESCUELA BASICA EL CRUCERO
1156;ESCUELA BASICA G-24
1157;ESCUELA BASICA LOS ALAMOS EL SOBRANTE
1158;ESCUELA BASICA BENANCIO PEREZ
1160;ESCUELA HOGAR FRONTERIZA DE CHALACO
1161;ESCUELA BASICA PEDEGUA
1162;ESCUELA PARTICULAR JUAN PABLO II
1164;COL. CATOLICO PDTE.MANUEL MONTT
1166;COLEGIO SAGRADO CORAZON
1167;LICEO Y ESCUELA MUNICIPAL
1168;ESCUELA HANS WENKE MENGERS
1170;ESCUELA BASICA VALLE DE ARTIFICIO
1171;ESCUELA BASICA LA FRONTERA DE ALICAHUE
1173;ESCUELA ESTER SILVA SOMARRIVA BARTOLILLO
1174;ESCUELA BASICA SAN LORENZO
1176;ESCUELA PABLO NERUDA
1178;ESCUELA BASICA LA VINA
1180;ESCUELA BASICA G-45
1181;ESCUELA BASICA LOS ANGELES
1182;ESCUELA BASICA G-47
1183;LICEO DE ZAPALLAR
