RBD;NOM_RBD
16587;LICEO POLIVALENTE SAGRADA FAMILIA
16588;COLEGIO SAN ALFONSO DE EL BOLDO
16589;COLEGIO EL QUILLAY
16590;ESC.ESP.DE TRAST.DEL LENGUAJE SAN VALENTIN
16591;ESCUELA DE LENGUAJE ARRAYAN
16592;ESCUELA LENGUAJE SAN CLEMENTE
16594;COLEGIO EL SEMBRADOR
16595;ESCUELA DE LENGUAJE ANTUPIREN
16597;ESCUELA DE LENGUAJE ZARCILLO
16598;COLEGIO VERBUM
16599;ESCUELA LENGUAJE PROSPERIDAD
16600;COLEGIO ALTA CUMBRE
16601;ESCUELA ESPECIAL DE LENGUAJE ALTAMIRA
16602;CENTRO LENGUAJE DALUZ 2
16603;ESC. LENGUAJE ARCOIRIS
16604;INSTITUTO LATINOAMERICANO-EUROPEO DE
16606;ESCUELA DE PARVULOS SAN AGUSTIN
16607;ESCUELA DE LENGUAJE ALBORADA
16608;COLEGIO ANTILHUE
16610;ESCUELA DE LENGUAJE EDUCAR
16613;ESCUELA DE LENGUAJE BELEN
16615;ESC.DE LENGUAJE Y JARDIN INFANTIL ECOLOGICO
16617;SALA CUNA Y JARDIN INFANTIL MICKEY MOUSE
16619;ESCUELA DE LENGUAJE BAMBI
16622;ESCUELA DE LENGUAJE GARDEN SCHOOL
16623;ESCUELA DE LENGUAJE RAIGUEN
16624;COLEGIO ANTARES
16625;COLEGIO PABLO DE ROKHA
16627;COLEGIO SAN IGNACIO DE TALCA
16630;CENTRO EDUCATIVO DE LENGUAJE ANDALEN
16631;ESCUELA DE LENGUAJE TORREBLANCA
16633;ESCUELA DE LENGUAJE ABEJITA MAYA
16634;COLEGIO POLITECNICO AQUELARRE
16636;ESCUELA DE LENGUAJE MILLAHUE
16637;ESCUELA DE LENGUAJE ESTRELLITA FUGAZ
16639;ESCUELA INTY LLAN
16640;ESCUELA DE LENGUAJE SAN VALENTIN SUR ORIENTE
16642;COLEGIO ANTAMARO
16644;COLEGIO LEONARDO DA VINCI
16645;COLEGIO LAS ESTRELLITAS
16646;ESCUELA DE LENGUAJE ARCOIRIS
16647;COLEGIO ESPECIAL CRECER
16649;ESCUELA ESPECIAL SAN VICENTE
16652;CENTRO EDUCATIVO MACHU PICCHU
16654;ESCUELA DIFERENCIAL LOS GERANIOS
16656;LICEO VICTORIA
16659;ESCUELA DE LENGUAJES EDUCALEN
16661;ESCUELA DE PARVULOS PRINCIPITO DE SANTA ANA
16662;JARDIN INFANTIL CASTILLO PALABRAS MAGICAS
16663;ESCUELA DE LENGUAJE CARACOLA
16664;ESCUELA DE PARVULOS SAN JOSE DE CALASANZ
16665;JARDIN INFANTIL SONRISAS
16666;ESCUELA DE LENGUAJE RENACER
16668;ESCUELA ESPECIAL DE LENGUAJE NINO JESUS
16671;ESCUELA ESPECIAL DE LENGUAJE SAN ESTEBAN
16672;ESCUELA ESPECIAL DE LENGUAJE ALHUE
16673;COLEGIO CLUB DE LEONES TALCA
16675;ESCUELA ESPEC. DE LENGUAJE ALFREDO GIDI JALIL
16676;LICEO COMPLEJO EDUCACIONAL JAVIERA CARRERA
16677;COLEGIO IRIS RETAMAL
16678;COLEGIO LOS AGUSTINOS EDUCA Y DEPORTE
16679;CTRO. EDUCACIONAL Y ESC. DE LENGUAJE PABLO FR
16683;ESCUEA ESPECIAL DE LENGUAJE MILLARAY
16685;COLEGIO HENRI CETTY
16686;ESCUELA ESPECIAL DE LENGUAJE REY LEON
16687;CENTRO PEDAGOGICO PREESCOLAR VALLE DEL MAULE
16689;COLEGIO ESPECIAL DE DISCAPACIDADES MULTIPLES
16690;COLEGIO SUYAI
16692;ESCUELA ESPECIAL DE LENGUAJE GIRASOL
16693;ESCUELA ESPECIAL DE LENGUAJE SEMBRANDO PALABR
16694;ESCUELA DE LENGUAJE REMOLINO
16695;ESCUELA BASICA DE ADMINISTRACION Y COMERCIO
16696;ESCUELA HOSPITAL LINARES
16697;COLEGIO INITEC DE INNOVACION TECNOLOGICA
16698;CENTRO EDUCACIONAL KIMEL
16699;ESCUELA ESPECIAL UNPADE
16701;ESC.DE LENGUAJE Y JARDIN INFANTIL NELTUME
16702;ESC.ESPECIAL DE LENGUAJE HABLAPALABRAS
16703;ESCUELA ESPECIAL DE LENGUAJE MIS PRIMERAS PAL
16704;COLEGIO CLEMENTINOS
16708;COLEGIO PARTICULAR JOSEFINA MEDEL
16709;ESCUELA ESPECIAL DE LENGUAJE APRENDER
16711;ESCUELA DE LENGUAJE Y JARDIN INFANTIL PEQUEÑO
16712;JARDIN INFANTIL MAGIC CASTLE
16713;COLEGIO SAN PABLO
16715;COLEGIO EL BOLDO
16716;LICEO BICENTENARIO ZAPALLAR DE CURICO
16717;COLEGIO SANTA MADRE DE DIOS
16718;ESCUELA ESPECIAL DE LENGUAJE ANTONIO CASTRO A
16721;ESCUELA ESP. CENTRO DE INTEGRACION PADRE PIO
16722;COLEGIO CRISTIANO DE EDUC. DE ADULTOS EL SEMB
16723;ESCUELA HOSPITALARIA DE CAUQUENES
16725;ESCUELA ESPECIAL DIFERENCIAL SOL Y LUNA
16727;COLEGIO DE ADULTOS PROMAUCAES
16728;COLEGIO SANTO TOMAS DE TALCA
16729;INSTITUTO INGLES
16730;ESCUELA ADMINISTRACION Y COMERCIO HUMANISTA C
16731;ESCUELA ESPECIAL DE LENGUAJE ENSEÑARTE
16732;COLEGIO ALTO PEWEN
16733;COLEGIO ALTAS CUMBRES DE SAN CLEMENTE
16734;JARDIN INFANTIL MIS TESOROS
16735;ESCUELA DE LENGUAJE EL CASTILLO INFANTIL
16739;CLARO DE LUNA CENTRO DE DESARROLLO COGNITIVO
16740;ESCUELA DE LENGUAJE MARIA DIZA PINO
16743;ESCUELA ESPECIAL AMANECER LONGAVI
16744;COLEGIO SAN ESTEBAN DE TALCA
16745;ESCUELA DE LENGUAJE MARCELA PAZ
16747;COLEGIO RAUQUEN CAMPO
16748;LICEO BICENTENARIO ORIENTE DE TALCA
16749;COLEGIO JUAN IGNACIO MOLINA DE LA FLORIDA
16751;LICEO BICENTENARIO DE CAUQUENES
16752;CENTRO EDUCACIONAL INTEGRAL ADULTOS VICTORIA
16753;ESCUELA ESP. LENGUAJE Y PARVULOS SAN ESTEBAN
16754;LICEO ARTURO ALESSANDRI PALMA
16756;COLEGIO LOS AGUSTINOS
16757;COLEGIO JUAN IGNACIO MOLINA DE LICANTEN
16758;ESCUELA ESPECIAL DE LENGUAJE ALTAHIR
16759;ESC ESPECIAL DE LENGUAJE MIS PEQUEÑOS TESOROS
16761;INSTITUTO DE EDUCACION ESPECIAL CURICO
16764;ESCUELA ESPECIAL DE LENGUAJE PALABRAS Y COLORES
16766;GOLDEN EAGLE SCHOOL
16767;ESCUELA ESPECIAL DE LENGUAJE AMAPOLA ALERCE
16768;CENTRO EDUCACIONAL SONRISA DE ANGELES
16770;COLEGIO ALIWE COLLEGE
16773;ESCUELA ESPECIAL N°2424 EL  VOLANTIN
16774;ESCUELA ESPECIAL DE LENGUAJE SAN IGNACIO
16775;ESCUELA ESPECIAL DE LENGUAJE PEQUEÑO SAFARI
16777;ESCUELA  DE  PARVULOS  Y  ESPECIAL  N°197 AMARAL
16778;CENTRO DE FORMACION LABORAL HUELLAS
16779;ESCUELA ESPECIAL DE LENGUAJE PALABRAS DE NIÑOS
16780;COLEGIO ALTO LAUQUÉN
16781;ESCUELA ESPECIAL DE LENGUAJE ALTO LOS ÁNGELES
16782;ESCUELA ESPECIAL DE LENGUAJE REMOLINO
16783;COLEGIO HOSPITALARIO HOSPITAL DEL  PINO
16784;ESCUELA DIFERENCIAL CABALLITO DE MAR
16785;ESCUELA ESPECIAL DE  LENGUAJE LOS  CHAVITOS
16788;ESCUELA ESPECIAL N°197 MI  PEQUEÑO  MOZART
16789;ESCUELA ESPECIAL N°2427 CARNAVAL
16790;ESCUELA  DE  PARVULOS  Y  ESPECIAL  BASILEA
16791;ESC. ESP. DE LENGUAJE CUMBRES DE PLACILLA
16792;COLEGIO HALCONES DEL CARMEN
16793;LICEO TECNICO PROFESIONAL LA ARAUCANA
16794;ESCUELA NUEVA MILLARAYEN
16795;ESCUELA  BASICA N°231 LA VILLETTE 1
16797;ESC. ESP. DE LENGUAJE AMANECER DE COLORES
16798;COLEGIO NEW BUCKINGHAM
16799;CENTRO DE EDUCACION INTEGRADO DE  ADULTOS GLADYS LAZO Nº 2
16800;ESCUELA ESPECIAL DE LENGUAJE ESMERALDA BARQUITO DE SUEÑOS
16802;ESCUELA ESPECIAL DE LENGUAJE SONRISAS
16803;ESCUELA ESPECIAL DE LENGUAJE PALABRAS MAGICAS SALTO DEL LAJA
16806;CENTRO EDUCACIONAL AYECANTUN
16807;COLEGIO LOS  ALERCES  DE  TALAGANTE
16808;ESCUELA  ESPECIAL N°232 EL ARCA
16809;ESCUELA  ESPECIAL N°198 LOS  GIRASOLES
16810;ESCUELA  ESPECIAL  N°199 EL  AROMO
16811;ESCUELA ESPECIAL N° 2430 SAN ALBERTO HURTADO
16812;ESCUELA ESPECIAL PARAPEQUES
16813;ESCUELA ESPECIAL NUEVA ESPERANZA
16814;ESCUELA ESPECIAL N°199, MI  POLLITO  AMARILLITO
16816;ESCUELA  BASICA N°201, REDWOOD COLLEGE
16817;ESCUELA DE LENGUAJE HABLA PALABRA
16820;COLEGIO  PAULO  FREIRE  DE  SAN  MIGUEL
16821;ESCUELA ESPECIAL APRENDAMOS JUNTOS
16825;ESCUELA  BASICA  N°200 COLEGIO  INTEGRAL TRABUNCO
16826;ESCUELA  ESPECIAL  N°2435 AITUE
16827;ESCUELA ESPECIAL Y DE PARVULOS PETIT PRINCE
16828;ESCUELA ESPECIAL ANTUMALEN N°202
16830;RIELJAN COLLEGE
16831;ESCUELA ESPECIAL DE LENGUAJE MARIA MONTESSORI
16832;ESCUELA  ESPECIAL  2438 `PEQUEÑOS  GENIOS  DE  VALLE  GRANDE`
16834;JARDÍN INFANTIL JIRAFITA
16837;ESC.ESP.N°2439, MANQUEHUE DE TIL TIL
16838;ESCUELA ESPECIAL DIFERENCIAL EXPRESION DE AMOR
16839;ESCUELA ESPECIAL DE LENGUAJE SAN MARCOS
16840;COLEGIO DE ADULTOS RENACIMIENTO
16843;LICEO TECNICO PROFESIONAL PEOPLE HELP PEOPLE DE PANGUIPULLI
16844;LICEO TECNICO PROFESIONAL PEOPLE HELP PEOPLE PULLINQUE
16845;ESCUELA ESPECIAL DE LENGUAJE SARAH KAY
16846;COLEGIO MIS IDEAS
16847;ESCUELA DEL CARIÑO HENRY CETTY
16848;ESCUELA ESPECIAL DE LENGUAJE PALABRAS DULCES
16849;INSTITUTO EDUCACIONAL DE ADULTOS HERMANOS CARRERA
16851;INSTITUTO BICENTENARIO JAVIERA CARRERA VERDUGO
16854;JARDIN INFANTIL NIÑOS LUZ
16855;ESCUELA SARGENTO PRIMERO CRISTIAN VENEGAS OJEDA
16856;COLEGIO MELIAN
16857;CENTRO  EDUCACIONAL  DE  ADULTOS  EL MONTE
16858;ESCUELA ESPECIAL DE LENGUAJE SEMILLA DE GIRASOL
16859;ESCUELA DE PARVULOS N° 201 `MIKY`
16861;ESCUELA DE LENGUAJE DIEGO DUBLE URRUTIA
16862;ESCUELA DE LENGUAJE AGUA SOL
16864;ESCUELA ESPECIAL DE LENGUAJE PEQUEÑOS AMIGOS
16865;ESCUELA ESPECIAL DE LENGUAJE MI PEQUEÑO SUEÑO
16866;ESCUELA  ESPECIAL  N° 2440 LEONARDO  DA  VINCI
16868;ESCUELA ESPECIAL DE LENGUAJE COMUNICA
16869;ESCUELA ESPECIAL DE LENGUAJE EL CASTILLO DE IGNACIA
16871;CENTRO DE EDUCACION INTEGRAL DE ADULTOS PAIDEIA
16873;ESCUELA LENGUAJE VER Y HABLAR
16874;ESCCUELA CDP YUMBEL
16876;ESCUELA DE LENGUAJE ALUN
16877;ESCUELA DE LENGUAJE NAMASTE
16878;ESCUELA ESPECIAL ECOLÓGICA N°2441, MAPU LIHUEN
16879;ESCUELA BÁSICA N°2442 `CENTRO EDUCACIONAL ERNESTO YAÑEZ RIVERA`
16880;ESCUELA ESPECIAL N°  203 ALTO BUIN II
16881;COLEGIO FILII FUTURI
16882;CENTRO EDUCACIONAL INTEGRAL QUIDELL
16883;ESCUELA ESPECIAL EL ARBOL
16886;COLEGIO VALLES DEL MAIPO
16887;CENTRO DE ESTUDIOS CREA FUTURO
16888;ESCUELA ESPECIAL N° 2446 `VOCES`
16889;ESCUELA ESPECIAL N° 2445 PAPELUCHO
16890;ESCUELA BÁSICA N° 2444 `QHAPAQ KUNA`
16892;CENTRO DE ESTUDIO DE LA PATAGONIA
16893;ESCUELA ESPECIAL N°2443 ARCOIRIS
16894;ESCUELA ESPECIAL N°204 ANGEL MIGUEL
16895;COLEGIO MARIA AUXILIADORA
16897;ESCUELA DE PARVULOS PLANETA TIERRA II
16899;ESCUELA ESPECIAL DE LENGUAJE AMAPOLA
16900;ESCUELA ESPECIAL DE LENGUAJE MONTEACAY
16901;ESCUELA ESPECIAL DE LENGUAJE RUCAHUE
16902;ESCUELA ESPECIAL DE LENGUAJE MI CASTILLO
16904;ESCUELA ESPECIAL N° 2447 `ESTRELLITAS  DE SAN JOSÉ`
16905;ESC.ESP.DE LENGUAJE Y COMUNICACIÓN `MUNDO FELIZ`
16906;CURAUMA LANGUAGE SCHOOL, ESC. ESP. DE LENG. Y DE PARV
16908;ESCUELA ESPECIAL DE LENGUAJE MATEITOS
16909;ESCUELA ESPECIAL TEMAIKEN
16910;ESCUELA BASICA PEUMA MEW
16911;ESCUELA ESPECIAL DE LENGUAJE PEQUEÑAS PALABRAS
16912;ESCUELA ESPECIAL DE LENGUAJE AQUALUNA
16913;ESCUELA ESPECIAL PADRE PIO
16914;ESCUELA ESPECIAL SAN JOSE
16915;CENTRO DE EDUCACION INTEGRADA DE ADULTOS NAHUELQUIN
16916;ESCUELA ESPECIAL DEL LENGUAJE ARBOLITO
16918;ESCUELA ESPECIAL DE LENGUAJE HIJOS DEL REY
16919;COLEGIO CUMBRES DE COIHUECO
16921;ESCUELA ESPECIAL N°234 `LAS FLORES`
16922;LICEO TECNICO PROFESIONAL DE ADULTOS CHILOE
16923;THE BRISTISH SCHOOL PATAGONIA
16924;COLEGIO BELLO HORIZONTE
16925;ESCUELA ESPECIAL DE LENGUAJE MI CASTILLO FELIZ
16926;ESCUELA ESPECIAL DE LENGUAJE PINARES Y ESCUELA BÁSICA PINARES
16927;COLEGIO SAN FERNANDO T.P.
16928;ESCUELA ESPECIAL DE LENGUAJE EL DESPERTAR
16932;COLEGIO ESCUELA PREMILITAR LAUTARO
16933;ESCUELA ESPECIAL DE LENGUAJE DESCUBRE PALABRAS
16935;LICEO TECNICO PROFESIONAL DE ADULTOS DE ANTOFAGASTA
16936;ESCUELA ESPECIAL DE LENGUAJE DORA
16937;ESCUELA ESPECIAL DE LENGUAJE SAN SEBASTIAN
16938;ESCUELA ESPECIAL DE LENGUAJE RAYUN
16939;ESCUELA DE PARVULOS TINKERBELL
16941;ESCUELA YAIMA
16942;COMPLEJO EDUCACIONAL CRISTO REY
16945;COLEGIO NUEVO HORIZONTE
16946;ESCUELA  ESPECIAL N° 2449,  `DE LA  MERCED`
16947;ESCUELA ESPECIAL DE LENGUAJE MI PEQUEÑO GRAN MUNDO
16949;ESCUELA ESPECIAL DE LENGUAJE NAHUEN
16950;CENTRO EDUCACIONAL SAN PEDRO DE QUELLON
16952;ESCUELA ESPECIAL DE DISCAPACIDAD INTELECTUAL CORAZON DE JESUS
16953;ESCUELA  ESPECIAL  N°235, `EL PRINCIPITO DE PUENTE  ALTO`
16954;ESCUELA ESPECIAL DE LENGUAJE MIS PRIMEROS PASOS
16955;ESCUELA BASICA N° 2450
16956;ESCUELA ESPECIAL N° 2451 `PUCALAN`
16957;ESCUELA  ESPECIAL DE LENGUAJE PETRICOR
16958;COLEGIO  ARTISTICO SOL DEL  ILLIMANI
16960;ESCUELA ESPECIAL DE LENGUAJE Y JARDIN INFANTIL CASTILLO TIA PAOLA
16961;ESCUELA ESPECIAL DE LENGUAJE CHOL-CHOL
16962;ESCUELA MONTE SINAÍ
16963;ESCUELA ESPECIAL N° 2453 `THE ALMOND SCHOOL II`
16964;ESCUELA ESPECIAL DE LENGUAJE PALABRITA
16966;ESCUELA ESPECIAL DIFERENCIAL FLORECER
16967;COLEGIO ESPECIAL LOS ARRAYANES
16968;ESCUELA ESPECIAL DIFERENCIAL BENDICIONES DE AMOR
16970;EDUCERE COLLEGE
16971;ESCUELA  ESPECIAL N°205 ,`MI MUNDO  EN  PALABRAS`
16972;ESCUELA ESPECIAL CREA Nº2455
16973;ESCUELA ESPECIAL DIFERENCIAL PALU
16974;ESCUELA ESPECIAL DE LENGUAJE YIREH LOS MOLLES
16975;COLEGIO UNIÓN FRATERNA
16980;ESCUELA  BASICA  N° 206, `PULMAHUE`
16981;ESCUELA DE PARVULOS CONEXIONES
16983;COLEGIO EL CASTILLO
16984;ESCUELA ESPECIAL DE LENGUAJE PIMPINO
16985;LICEO DE ALTA EXIGENCIA PAULO FREIRE
16986;LOS CAPULLITOS
16987;ESCUELA  ESPECIAL N° 2456 `TU  ARCOIRIS`
16988;ESCUELA ESPECIAL DE LENGUAJE MAKIATO
16990;ESCUELA ESPECIAL DE LENGUAJE MAGRACE
16991;ESCUELA ESPECIAL DE LENGUAJE GREEN DAY
16992;ESC. ESP. DE LENG. TROMPITA DE COLORES
16993;CENTRO EDUCACIONAL DE ADULTOS AUROMAR
16994;ESC.ESP.N°236 `MILLARAY DE CASAS VIEJAS`
16995;ESCUELA ESPECIAL DIVINO NIÑO JESUS
16997;COLEGIO AMERICAN SCHOOL
16998;ESCUELA ESPECIAL DE LENGUAJE CONTIGO APRENDO
16999;ESCUELA ESPECIAL DE LENGUAJE PIONEROS
17000;COLEGIO ALTA CUMBRE
17001;ESCUELA ESPECIAL DE LENGUAJE EL SOL DE QUILACO
17600;COLEGIO SAN GABRIEL ARCANGEL
17605;COLEGIO INGLÉS WOODLAND
17607;COLEGIO INGLÉS BRITISH ROYAL SCHOOL
17635;COL. TECNICO PROFESIONAL LOS ACACIOS
17636;ESCUELA CENTRO ECOEDUCATIVO LAS TRANCAS
17638;COLEGIO SANTO TOMAS DE AQUINO
17640;ESCUELA BASICA EL PILME
17641;ESCUELA BASICA CANA DULCE
17642;JARDIN INFANTIL FABIOLA
17643;LICEO AGRICOLA DE NEGRETE
17644;PARVULARIO COLEGIO ADVENTISTA DE COMCEP.
17647;TALLER DE CAPACITACIÓN LABORAL UNPADE
17648;COLEGIO PARTICULAR KENNEDY SCHOOL
17650;CENTRO DE CAPACITACIÓN URCAE
17652;COLEGIO RAIQUEN
17654;CENTRO EDUCACIÓN INTEGRADA DE ADULTOS
17655;ESCUELA MUNICIPAL CARRIZAL - MENIR
17657;INSTITUTO DE HUMANIDADES ANTONIO MORENO CASAMITJANA
17660;SCUOLA ITALIANA DI CONCEPCION
17662;LICEO CLAUDIO ARRAU LEON
17679;ANEXO COME WEALTH SCHOOL
17686;COLEGIO ADVENTISTA CONCEPCIÓN
17687;COLEGIO TERESIANO LOS ANGELES
17689;COLEGIO LICANRAY
17690;COLEGIO BEATO DAMIÁN DE MOLOKAI
17692;COLEGIO GOLDEN SCHOOL
17693;COLEGIO BASICO NUEVA LOS LOBOS
17698;ESCUELA RAMÓN VINAY SEPÚLVEDA
17699;ESCUELA ESP.DIF.CENTRO EDUCATIVO INTEGRAL LOS NARANJOS
17701;CENTRO DE EDUCACIÓN DE ADULTOS NEWENTUN
17703;COLEGIO ESPIRITU SANTO
17704;ESCUELA AMANDA LABARCA
17708;COLEGIO SAN CRISTOBAL
17709;ESCUELA BALMACEDA SAAVEDRA L.
17710;ESCUELA BASICA EL MIRADOR
17711;ESCUELA BASICA EL ESPINO
17715;ESCUELA ACUMAR
17718;JARDIN INFANTIL WONDERFUL WORDL
17719;COLEGIO PARTICULAR CONTINENTAL
17723;ESCUELA DIEGO PORTALES
17725;COLEGIO SAN ESTEBAN DE BULNES
17726;CCENTRO EVANGÉLICO PARA EDUCACIÓN ADULTOS
17728;COLEGIO EL BOSQUE
17732;COLEGIO UMBRALES DEL ALBA
17733;COLEGIO CAMILO HENRIQUEZ
17734;COLEGIO DA VINCI
17735;COLEGIO DARIO SALAS
17736;COLEGIO SAN IGNACIO
17737;COLEGIO PARROQUIAL SAN JOSE
17739;JARDIN INFANTIL ANIBAL ESQUIBEL TAPIA
17741;ESCUELA REINO DE SUECIA
17742;ESCUELA BASICA EDUARDO FREI MONTALBA
17745;COLEGIO STERNENKINDER NIÑOS DE LAS ESTRELLAS
17746;COLEGIO OLIMPIA GUZMAN BELLO
17749;ESCUELA PUCARA
17750;COLEGIO SALESIANO DE CONCEPCION
17751;ESCUELA VILLA LA GRANJA
17753;ESCUELA DIFERENCIAL ALTO DEL REY
17754;CENTRO DE EDUCACION DE ADULTOS INTECH
17762;ESCUELA PARTICULAR BAJO QUILANTAHUE
17763;ESCUELA PARTICULAR CUYIMPALIHUE
17765;COLEGIO MADRE PAULINA
17766;COLEGIO SAN JOSE
17768;PARVULARIO EL NAZARENO
17771;ESCUELA DE TRASTORNOS DE LA COMUNICACIÓN MILLARAY
17772;LICEO POLITECNICO CANETE
17776;ESCUELA ESPECIAL AMANECER
17778;COLEGIO SAN JUAN DE DIOS
17779;COLEGIO PACIFIC SCHOOL
17781;COLEGIO DE LENGUAJE SENDEROS DEL BIOBÍO
17782;LICEO RIOS DE CHILE
17784;CENTRO DE CAPACITACIÓN Y ESTUDIOS LABORALES UNPADE
17785;ESCUELA VILLA CENTINELA SUR
17787;ESCUELA ORLANDO VERA VILLARROEL
17788;COLEGIO AMANECER
17790;LICEO NUEVO MUNDO
17791;CENTRO DE ATENCION INFANTIL TAMBORIN
17793;COLEGIO CONCEPCION DE SAN CARLOS
17794;COLEGIO CONCEPCION DE CHILLAN
17795;INSTITUTO PROFESIONAL Y CENTRO DE FORMACIÓN TÉCNICA SANTA LUCÍA E.I.R.L.
17796;COLEGIO ADULTOS RENACER
17797;ARAUCARIA SCHOOL
17798;COLEGIO ACUMAR
17799;ESCUELA ESPECIAL TRASTORNOS DE LA COMUNICACIÓN NAHUEL
17800;COLEGIO SYDNEY COLLEGE
17802;INSTITUTO DOWN
17807;ESCUELA DE LENGUAJE JESUS MAESTRO
17809;ESCUELA DE LENGUAJE SANTISIMA TRINIDAD
17810;CENTRO DE EDUCACIÓN DE ADULTOS QUIMAHUE
17812;COLEGIO CONCEPCION CHIGUAYANTE
17813;ESCUELA BÁSICA CACIQUE LEVIÁN
17814;ESCUELA ALTO CABRERO
17816;ESCUELA DIFERENCIAL CON TRASTORNO LENGUAJE MI VENTANA
17817;COLEGIO PARTICULAR FRANCYS
17818;LICEO TECNICO PROFESIONAL DE LA MADERA
17821;CENTRO DE LENGUAJE EL UMBRAL
17822;ESC. ESP. DE TRANST. COMUN DOMINGO PARRA
17823;ESCUELA ESPECIAL DE LENGUAJE WENGA
17824;COLEGIO CLARO DE LUNA COLLEGE
17828;ESCUELA EVANGÉLICA BETH-EL
17829;CENTRO DE ESTUDIO LA ARAUCANA
17830;CENTRO PSICOPEDAGÓGICO DE ESTIMULACIÓN TEMPRANA CADI
17832;ESCUELA ESPECIAL DE TRASTORNOS DE LA COMUNICACIÓN ABRA PALABRA
17833;COLEGIO ETCHEGOYEN TALCAHUANO
17834;COLEGIO SAN FERNANDO
17835;JARDIN INFANTIL ANIBAL ESQUIVEL
17836;ESCUELA DE PÁRVULOS SAN FRANCISCO
17837;ESCUELA DE PARVULOS EL ARENAL
17838;COLEGIO TECNOLOGICO DARIO SALAS
17840;ESCUELA BASICA NAHUELBUTA
17843;COLEGIO AURORA DE CHILE CHIGUAYANTE
17846;CENTRO EDUCACION INTEGRAL DE ADULTOS
17847;INSTITUTO EDUCACIÓN DE ADULTOS RUBÉN CAMPOS LÓPEZ
17848;YIRE LICEO POLITECNICO DE COIHUECO
17850;COLEGIO PADRE MANUEL D`ALZON
17852;ESCUELA ESPECIAL DE LENGUAJE Y JARDÍN INFANTIL LOS ÁNGELES
17854;COLEGIO VILLA NONGUEN
17855;COLEGIO INMACULADA CONCEPCION
17857;LICEO OBISPO SAN MIGUEL
17858;COLEGIO MIXTO INMACULADA CONCEPCION
17859;COLEGIO ALMONDALE
17860;COLEGIO SAN LUIS
17863;JARDIN INFANTIL ADVENTISTA DE CHILLAN
17865;JARDIN INFANTIL BOTECITO DE PAPEL
17871;JARDIN INFANTIL TIMONEL LA ALEGRIA DE APRENDE
17872;ESCUELA DE LENGUAJE AMANECER
17874;ESCUELA EDELMIRA VERGARA QUIÑONES
17875;COLEGIO SAN JOAQUIN
17876;AMERICAN JUNIOR COLLEGE
17877;COLEGIO PADRE ALBERTO HURTADO LOS ANGELES
17879;CENTRO EDUCACIÓN INTEGRAL DE ADULTOS JANEQUEO - CONCEPCIÓN
17880;CENTRO DE EDUCACIÓN DE ADULTOS ADELAILA MORENO
17881;CENTRO EDUCACIÓN INTEGRADO ADULTOS FERMÍN FIERRO LUENGO
17882;ESCUELA ESPECIAL TRASTORNOS DE LA COMUNICACIÓN AYLEM
17883;COLEGIO SAN TERESA DE LOS ANDES - LOS ANGELES
17884;ESCUELA ESP.TRAST.LENGUAJE Y J.INFANTIL TITIRIMUNDI
17885;LICEO POLIVALENTE TOME - ALTO
17886;ESC.ESP.DE TRASTORNO DE LA COMUNICACION DINAB
17888;ESCUELA ESPECIAL SOL DE LOS ANGELES
17889;JARDIN INFANTIL RINCÓN DE LOS NIÑOS
17892;LICEO POLIVALENTE MARTA COLVIN ANDRADE
17894;CENTRO DE ESTIMULACION TEMPRANA ELIM
17895;COLEGIO SAN FERNANDO
17897;ESCUELA GLORIAS NAVALES
17898;ESCUELA SERGIO MARTIN ALAMOS
17899;ESCUELA ESPECIAL CERES
17900;COLEGIO METODISTA CONCEPCION
17901;ESCUELA DE LEGUANJE EL FARO
17902;COLEGIO TERESA DE LOS ANDES
17903;SEBASTIAN SCHOOL
17907;COLEGIO CREACIÓN CHILLÁN
17908;COLEGIO POLIVALENTE PADRE ALBERTO HURTADO
17910;ESCUELA DE LENGUAJE ARCO IRIS
17911;ESCUELA ESPECIAL DE TRASTORNO DE LA COMUNICACIÓN SAN RODRIC
17912;COLEGIO CREACIÓN CONCEPCIÓN
17914;ESCUELA ESPECIAL DE LENGUAJE TIEMPO NUEVO
17915;COLEGIO POLIVALENTE DOMINGO PARRA CORVALAN
17916;ESCUELA DAFNE ELVIRA ZAPATA ROZAS
17917;JARDÍN INFANTIL PINTITAS
17918;COLEGIO SAINT GEORGE SCHOOL
17920;COLEGIO HISPANO AMERICANO RIO VIEJO
17922;COLEGIO THE PACIFIC SCHOOL
17924;ESCUELA NACIMIENTO DE NUESTRO SEÑOR
17925;ESCUELA ESPECIAL DE LENGUAJE Y JARDÍN INFANTIL TUTUMPI
17926;COLEGIO 20 DE AGOSTO
17928;JARDIN INFANTIL MI MUNDO
17930;ESCUELA EL LLANO
18001;CENTRO DE ESTIMULACION TEMPRANA EGO SUM
18002;ESCUELA JOSE FRANCISCO PINO MEDINA
18003;ESCUELA DE LENGUAJE SAN NICOLAS
18004;LICEO TÉCNICO PROFESIONAL ALONSO DE ERCILLA Y ZÚÑIGA
18006;ESCUELA ELISE MOTTART
18008;ESCUELA ESPECIAL AMPALU
18009;CENTRO INTEGRAL ADULTOS PAUL PERCIVAL HARRIS
18010;COLEGIO SAN FERNANDO CHILLÁN VIEJO
18011;ESC. ESPEC. DE LENGUAJE SENDEROS DE SAN PEDRO
18012;ESCUELA MARTA COLVIN ANDRADE
18014;ESCUELA BASICA LOS CONQUISTADORES
18015;ESCUELA BASICA FORJADORES DE CHILE
18016;ESCUELA BASICA PUEBLO SECO
18017;LICEO TÉCNICO PROFESIONAL VIOLETA PARRA SANDOVAL
18018;JARDIN INFANTIL TIERNO AMANECER
18020;ESCUELA DE LENGUAJE ALTOS DE CHIGUAYANTE
18021;ESCUELA DIEGO PORTALES PALAZUELOS
18024;ESCUELA ESPECIAL DE DISCAPACIDAD AUDITIVA Y TRASTORNOS GRAVES DE LA COMUNICACIÓN HÁBLAME DE AMOR
18025;ESCUELA DE LENGUAJE MAR AZUL
18026;ESCUELA DE LENGUAJE SAN SEBASTIAN
18027;ESCUELA DE LENGUAJE TIMONEL
18028;COLEGIO CIUDAD EDUCATIVA
18029;ESCUELA DE LENGUAJE SANTA MARIETTA
18030;ESCUELA DE LENGUAJE CICEL
18031;ESCUELA DE LENGUAJE FLORIDA
18032;CENTRO DE CAPACITACIÓN LABORAL EDUCACIÓN ESPECIAL PAULO FREIRE
18034;COLEGIO SOUTHERN COLLEGE
18035;COLEGIO SAN AGUSTIN
18037;LICEO RALCO
18038;ESCUELA DIFERENCIAL RAYITO DE SOL
18039;JARDÍN INFANTIL Y ESCUELA ESPECIAL DE LENGUAJE MAISON DE L´ENFANCE
18040;ESCUELA DE LENGUAJE Y JARDÍN INFANTIL PORVENIR
18042;COLEGIO WENGA CORONEL
18043;ESCUELA DE LENGUAJE LOMAS COLORADAS
18044;ESCUELA DE LENGUAJE Y JARDÍN INFANTIL TITIRIMUNDI
18045;CENTRO DE CAPACITACIÓN LABORAL BERNARDO O`HIGGINS
18049;COLEGIO ADVENTISTA DE CONCEPCION
18050;COLEGIO LA FUENTE
18051;ESCUELA BASICA DIFERENCIAL ARCO IRIS
18052;ESCUELA DE LENGUAJE CHILEDUCA
18054;CENTRO DE NIVELACIÓN Y DE CAPACITACIÓN PARA ADULTOS MADRE MARIA M Y S
18061;ESCUELA DE LENGUAJE BULNES
18062;ESCUELA DE LENGUAJE INALAF
18063;ESCUELA DE LENGUAJE BELEN
18065;ESCUELA NUEVA REPUBLICA
18066;COLEGIO AURORA DE CHILE SUR
18069;CENTRO INTEGRAL DE EDUCACIÓN HIGH SCOPE LIMITADA
18073;JARDIN INFANTIL JUAN BAUTISTA
18074;ESCUELA DE LENGUAJE SANTA JUANA
18075;COLEGIO JAHVE NISI
18077;CENTRO DE EXPLORACIÓN CAPACITACIÓN LABORAL SAN RAFAEL
18078;ESCUELA DE LENGUAJE EL VALLE
18079;ESCUELA DE LENGUAJE ASERRIN ASERRAN
18080;LICEO POLITECNICO CARAMPANGUE
18081;ESCUELA DE LENGUAJE EDUCERE
18082;ESCUELA ADULTOS INTECAP
18085;ESCUELA DE LENGUAJE MY DISNEY
18087;DINABEC COLLEGE
18088;CENTRO DE FORMACION LABORAL SAN ANDRES
18089;ESCUELA DE LENGUAJE BAMBI
18090;COLEGIO SAN LORENZO
18091;ESCUELA ESPECIAL LOS NARANJOS
18092;ESCUELA DE LENGUAJE LARAQUETE
18093;COLEGIO EL VALLE DE HUALQUI
18094;CHRISTIAN COLLEGE
18095;ESCUELA DE LENGUAJE SAN PABLO
18096;ESCUELA DE LENGUAJE ALBORADA
18097;COLEGIO ALMONDALE LOMAS
18099;ESCUELA TOMAS LAGO
18101;ESCUELA DE LENGUAJE ATRAPA PALABRAS
18102;COLEGIO PAULO FREIRE
18104;ESCUELA ESPECIAL DIFERENCIAL CENTRO DE RECURSOS PERSEVERA
18105;ESCUELA DE LENGUAJE GIRASOL
18106;ESCUELA ESPECIAL DEL MAR
18107;ESCUELA ESPECIAL DE LENGUAJE SEMILLITA
18108;ESCUELA ESPECIAL DE LENGUAJE QUIRIHUE
18109;ESCUELA ESPECIAL DIFERENCIAL SOL NACIENTE
18111;COMPLEJO EDUCACIONAL GLORIA MENDEZ BRIONES
18112;LICEO INES ENRIQUEZ FRODDEN
18113;ESCUELA ESPECIAL LOS GIRASOLES
18114;COLEGIO A-LAFKEN
18119;ESCUELA ESPECIAL DE LENGUAJE MATILDA
18121;ESCUELA ESPECIAL DE LENGUAJE PEQUEÑOS TESOROS
18122;ESCUELA ESPECIAL DE LENGUAJE CIDNEE
18123;COLEGIO Y ESCUELA DE LENGUAJE CENTRO EDUCACIONAL PEUMAYEN
18124;COLEGIO SANTA TERESITA
18126;COLEGIO PORVENIR SCHOOL
18127;CENTRO EDUCACIONAL ALBORADA
18128;COLEGIO SANTO TOMÁS
18130;ESCUELA ESPECIAL DE LENGUAJE AMANECER
18131;ESCUELA ESPECIAL DE LENGUAJE ENTRE PALABRAS
18132;ESCUELA ESPECIAL DIFERENCIAL LUIS ESPINOZA PIERRETTI
18133;ESC ESP DIF CENTRO ATENCION TEMPRANA Y BASICO ESPECIAL PASO A PASITO
18138;JARDIN INFANTIL CANTACUENTOS
18139;ESCUELA DE LENGUAJE RAYEN-ANTU
18140;JARDÍN INFANTIL EBEN-EZER
18142;CENTRO ESTIMULACIÓN TEMPRANA PRINCESITA MISIN
18143;ESCUELA DIFERENCIAL ESTRELLITA DE BELÉN
18144;ESCUELA ESPECIAL DE LENGUAJE PADRE ALBERTO HURTADO
18146;CENTRO DIFERENCIAL ESTIMULACIÓN TEMPRANA MANANTIAL
18147;COLEGIO EDUCA BIOBÍO
18149;COLEGIO RUCALHUE
18150;ESCUELA DIFERENCIAL ASPAUT CHIGUAYANTE
18152;INSTITUTO DE ATENCION A LA DIVERSIDAD INAD
18153;CENTRO PSICOPEDAGOGICO EMMANUEL
18154;ESCUELA ESPECIAL DE LENGUAJE TIMONEL CORONEL
18155;ESCUELA ESPECIAL DE LENGUAJE ARAUCO
18156;JARDÍN INFANTIL Y ESCUELA ESPECIAL DE LENGUAJE AGUA DE PEUMO
18157;ESCUELA ESPECIAL DE LENGUAJE RAYEN
18158;COLEGIO LICAN RAY
18159;ESCUELA DE LENGUAJE ALMENDRA
18160;ESCUELA ESPECIAL DE LENGUAJE CAMPANITA
18162;ESCUELA ESPECIAL DE LENGUAJE ANTUKUYEN
18164;ESCUELA ESPECIAL DE LENGUAJE VILLA HERMOSA
18166;CENTRO CAPACITACIÓN LABORAL MIRANDO EL FUTURO
18167;ESCUELA ESPECIAL DE LENGUAJE ARAUCARIA
18168;ESCUELA ESPECIAL DE LENGUAJE BUEN RETIRO
18169;ESCUELA ESPECIAL ANTU
18170;COLEGIO MONTE ÁGUILA COLLEGE
18172;COLEGIO AMANECER TALCAHUANO
18173;ESCUELA ESPECIAL DE LENGUAJE LAS PALMERITAS
18175;CENTRO FORMACIÓN LABORAL LIWENKO
18176;ESCUELA ESPECIAL DE LENGUAJE NUEVO FUTURO
18178;ESCUELA ESPECIAL DE LENGUAJE JARDÍN DE PALABRAS
18181;INSTITUTO HUMANIDADES MONSEÑOR JOSE MANUEL SANTO ASCARZA
18183;COLEGIO PER SÉ
18184;COLEGIO BORDERIO
18186;JARDIN INFANTIL LOS PECECITOS
18189;ESCUELA DE LENGUAJE AMULEN
18190;ESCUELA ESPECIAL DE LENGUAJE ALCAZAR
18191;ESCUELA ESPECIAL DE LENGUAJE ABRAPALABRA
18192;ESCUELA ESPECIAL DE LENGUAJE HUEPIL
18193;ESCUELA ESPECIAL DE LENGUAJE KETRAWUE
18194;ESCUELA ESPECIAL DE LENGUAJE PALABRITAS
18195;ESCUELA ESPECIAL DE LENGUAJE PEQUEÑOS SUEÑOS
18197;ESCUELA ESPECIAL DE LENGUAJE LLAIPÉN
18199;COLEGIO QUILLÓN
18200;ESCUELA ESPECIAL DIFERENCIAL ANGELITOS
18202;ESCUELA ESPECIAL DE LENGUAJE ALONKURA
18203;ESCUELA ESPECIAL DE LENGUAJE KIMALU
18204;JARDIN INFANTIL ZAPATITO JUGUETON
18205;ESCUELA ESPECIAL DE LENGUAJE BOSQUE MAGICO
18206;ESCUELA ESPECIAL DE LENGUAJE AMAPOLA
18207;ESCUELA ESPECIAL DE LENGUAJE PINTO Y APRENDO
18208;ESCUELA ESPECIAL DE LENGUAJE ALTO DEL LAJA
18210;ESCUELA ESPECIAL DE LENGUAJE SAN FRANCISCO DE ASIS
18211;ESCUELA ESPECIAL DE LENGUAJE MIS DULCES PALABRAS
18212;ESCUELA DE LENGUAJE EDUPLAY
18213;ESCUELA ESPECIAL DE LENGUAJE ADONAY
18214;JARDIN INFANTIL Y ESCUELA DE LENGUAJE PRIMEROS PASOS
18216;COLEGIO AMANECER
18218;COLEGIO NUEVOS HORIZONTES
18220;COLEGIO NUEVA ESPERANZA
18222;ESCUELA ESPECIAL DE LENGUAJE PASITOS
18223;COLEGIO EL FARO
18224;ESCUELA ESPECIAL DE LENGUAJE GOLDEN HOUSE
18225;ESCUELA ESPECIAL DE LENGUAJE CANTO DE LUNA
18226;ESCUELA ESPECIAL DE LENGUAJE PALABRAS MÁGICAS
18227;ESCUELA ESPECIAL DE LENGUAJE ALTO TUCAPEL
18230;ESCUELA ESPECIAL DE LENGUAJE EL TRENCITO
18231;ESCUELA ESPECIAL DE LENGUAJE CUMBRES DE SAN IGNACIO
18233;ESCUELA ESPECIAL DE LENGUAJE ARBOLIRIS
18234;COLEGIO ALTAZOR
18235;ESCUELA DE LENGUAJE ALTUE
18236;ESCUELA ESPECIAL DIFERENCIAL Y DE LENGUAJE MAISON DE L`ENFANCE
18237;COLEGIO AMANECER SAN CARLOS
18238;ESCUELA DE LENGUAJE ALBORADA
18239;ESCUELA ESPECIAL DE LENGUAJE MANQUIMAVIDA
18240;JARDIN INFANTIL JUGANDO APRENDO
18241;CENTRO DE EDUCACIÓN INTEGRAL DE ADULTOS NAHUELQUÍN
